4275,"PLACA HUEVO COD A 21 PK X1",0117000496
4276,"PLACA HUEVO COD A 22 PK X1",0117000497
4277,"PLACA HUEVO COD A 23 PK X1",0117000498
4278,"PLACA HUEVO COD A 24 PK X1",0117000499
4279,"PLACA HUEVO COD A 25 PK X1",0117000500
4280,"PLACA HUEVO COD A 26 PK X1",0117000501
4281,"PLACA HUEVO GAUDI 1693H PK X1",0117000502
4282,"PLACA HUEVO GAUDI 1695H PK X1",0117000503
4283,"PLACA HUEVO GAUDI 1696H PK X1",0117000504
4284,"PLACA HUEVO GAUDI 1697H PK X1",0117000505
4285,"PLACA HUEVO GAUDI 1755H PK X1",0117000506
4286,"PLACA HUEVO GAUDI 1756H PK X1",0117000507
4287,"PLACA HUEVO GAUDI 1758H PK X1",0117000508
4288,"PLACA HUEVO GAUDI 1800H PK X1",0117000509
4289,"PLACA HUEVO GAUDI 1757H PK X1",0117000510
4290,"PLACA HUEVO N45 PK X1",0117000544
4291,"PLACA HUEVO N50 PK X1",0117000547
4292,"PLACA HUEVO PASCUA 24CM PARPEN",0117000557
4293,"PLACA HUEVO PASCUA 32CM PARPEN",0117000558
4294,"PLACA HUEVO PASCUA 38CM PARPEN",0117000559
4295,"PLATO 17CM FELIZ AÑO PARTYSX6",0906000051
4296,"POLVO HORNEAR KEUKEN X800G",0105000041
4297,"PULSERA MOÑO ROSA LED PARTYS",0202000581
4298,"PASTA UNT FONDUE AGUILA X290G",0115000159
4299,"PASTA UNT AVELLANA AGUILAX290G",0115000160
4323,"PASTA UNT MANI BON O BON X290G",0115000161
4324,"PASTA UNT COFLER BLOCK X290G",0115000162
4325,"SEMILLA DE AMARANTO HV X25KG",0502000011
4326,"SEMILLA DE AMARANTO HV X500G",0502000013
4327,"SERVILLETA ARCOIRIS PARTYSX20",0907000057
4328,"SET ARAÑAS LUMINICAS PARTYS X4",0303000229
4329,"SET ARAÑA NEGRA PARTYS X8",0303000230
4330,"SET GLOBO GTE CONF MULTI DX",0204000481
4331,"TARTELETA SALADA EDEMY X150G",0103000013
4332,"TARTELETA SAL MED PUPPIS X150G",0103000016
4333,"TURRON PALM X25G",0802000172
4334,"VARIEGATO AVELL CRUNCH KEUKEN",0115000185
4335,"VARIEGATO FR ROJO KEUKENX2.5KG",0115000189
4336,"VARIEGATO FRUT ROJO KEUKENX5KG",0115000190
4337,"VARIEGATO MARACUYA KEUKEN X5KG",0115000191
4338,"VARIEGATO MARACUY KEUKENX2.5KG",0115000193
4339,"VASO POLIP ANANA PARTYSX6",0910000192
4340,"VASO POLIP RUISEÑOR PARTYSX6",0910000208
4341,"POSA HUEVO 75MM PK X1",0910000236
4342,"VELA ANIVERSARIO 15 MULT",0207000018
4343,"VELA BENG HOLOG CAD X1",0207000038
4344,"VELA BENG HOLOG CAD CAJA",0207000039
4345,"VELA BRILLOS ROSA N 0 PARTYS",0207000075
4356,"FLOR MUSICAL AZUL PARTYS",0207000259
4357,"VELA IMP CORAZON ROJO PARTYSX8",0207000506
4358,"VELA MUSICAL BLANCO PARTYS",0207000625
4359,"VELA MUSICAL ROSA PARTYS",0207000627
4360,"VELA NOCHE 1,45CM PARTYS X25",0207000634
4361,"VELA NRO 30 METAL ORO PARTYS",0207000639
4362,"VELA NRO 30 METAL PLATA PARTYS",0207000640
4363,"VELA RAYADA BLANCA PARTYS X24",0207000829
4364,"VELA 1ER AÑO NENA PARTYS SETX5",0207000862
4365,"VELA 1ER AÑO NENE PARTYS SETX5",0207000863
4366,"VINCHA CORONA AMAR LED PARTYS",0202000646
4367,"VINCHA MOÑO LUNAR LED PARTYS",0202000669
4368,"VINCHA MOÑO TELA LED PARTYS",0202000670
4369,"VINCHA RENO PELUCHE PARTYS",0304000033
4370,"ADORNO P/FOTO PAW PATROL LOLI",0205000003
4371,"AFICHE BV AVENGERS OTERO X2",0205000010
4372,"AFICHE BV MINNIE OTERO",0205000032
4373,"ANOTADOR AVENGERS OTERO X10",0205000127
4374,"ANOTADOR VILLANO FAV OTERO X10",0205000132
4375,"BANDERIN DRAGON BALL OTERO",0205000259
4376,"BANDERIN FROZEN OTERO",0205000261
4377,"BANDERIN GRANJA ZENON AC",0205000263
4378,"BANDERIN JURASSIC WORLD OTERO",0205000265
4379,"BOLSA JURASSIC WORLD OTEROX10",0205000342
4380,"BOLSA PAPEL TOY STORY OTEROX10",0205000368
4381,"BOLSA PAW PATROL OTEROX10",0205000369
4382,"BOLSA PEPPA PIG OTEROX10",0205000370
4383,"BOLSA PIRATAS OTEROX10",0205000373
4384,"BOLSA PJ MASKS OTEROX10",0205000374
4385,"PIROTIN N10 BBSHOWER NENE MOLP",0901000190
4402,"BOLSA PRINCESAS OTEROX10",0205000378
4403,"CORTINA METAL ESTRELL FUCS LWC",0201000238
4404,"CORTINA METAL ESTRELL ROJO LWC",0201000241
4405,"CORTINA PASTEL ROSA LWC",0201000255
4406,"MANI S/SAL TOST MKING X120G",0602000013
4407,"PASTAFROLA ALUM FIJA N30 MULTY",0114000479
4408,"MOLDE ALUM RED DESM N 32 MULTY",0114000494
4409,"PASTAFROLA FIJA N 20 MULTY",0114000636
4410,"PASTAFROLA FIJA N 22 MULTY",0114000637
4411,"PASTA AMER AZUL DECOR X500G",0115000018
4412,"PASTA AMER NEGRO DECOR X500G",0115000034
4413,"PINCHE PLAST ESCUD RIVER TRKX6",0201000514
4414,"PIROTIN N8 LUNA CELESTE MOLP",0901000306
4415,"PLACA FIG PASCUA COD A 1655 PK",0117000362
4416,"POCHOCLERA CELESTE LUNAR CLX10",0904000134
4417,"POCHOCLERA RAYAS AMA-BCO CLX10",0904000141
4418,"SALSA CARAMELO LHERITIER X200G",0115000167
4419,"SALSA P.DULCE LHERITIER X200G",0115000184
4420,"SET MYLAR CARS LWC X5",0204000501
4421,"SET MYLAR COLA SIRENA LWC X4",0204000502
4422,"SET MYLAR FROZEN LWC X5",0204000517
4423,"SET MYLAR MICKEY LWC X5",0204000519
4424,"SET PINCEL SILICONA CHM X2",0120000512
4425,"VARIEGATO MARACUYA TCLASS",0115000196
4426,"VIRUTA DECO CELESTE LWC",0201000873
4427,"VIRUTA DECO FUCSIA LWC",0201000874
4443,"VIRUTA DECO NARANJA LWC",0201000875
4444,"VIRUTA DECO ROSA LWC",0201000877
4445,"ABANICO PLUMA SUD",0202000002
4446,"ACEITE GIRASOL ALSAMAR X900CC",0111000001
4474,"ACIDO CITRICO TCLASS X100G",0105000001
4475,"AD COMUNION CALIZ RAYOS SM",0301000001
4476,"AD COMUNION CALIZ TRIGO SM",0301000002
4477,"AD COMUNION CAPILLA SM",0301000003
4478,"AD COMUNION CRUZ C/BIBLIA SM",0301000004
4479,"AD COMUNION FRASE SM",0301000005
4480,"DECO ANGEL MUERTE C/LUZ PARTYS",0202000003
4481,"AD TORTA CIRCO GM",0201000001
4482,"AD TORTA MARINERO GM",0201000002
4483,"AD TORTA PRINCESAS GM",0201000003
4484,"AD TORTA SMILEY GM",0201000004
4485,"AD TORTA UNICORNIO GM",0201000005
4486,"AFICHE BACKYARDIGANS OTERO",0205000005
4487,"AFICHE BOCA JR FDIA TC X2",0205000007
4488,"AFICHE BV A BALLERINA OTERO X2",0205000008
4489,"AFICHE BV ANGRY BIRDS OTERO X2",0205000009
4490,"AFICHE BV BAKUGAN OTERO X2",0205000011
4491,"AFICHE BV BARBIE OTERO",0205000012
4492,"AFICHE BV BARCELONA OTERO X2",0205000013
4493,"AFICHE BV BOB ESPONJA OTERO",0205000014
4494,"AFICHE BV BOCA JR TC X2",0205000015
4495,"AFICHE BV CAMPANITA OTERO",0205000016
4496,"AFICHE BV CHEVROLET OTERO",0205000018
4497,"AFICHE BV DOKI OTERO X2",0205000019
4498,"AFICHE BV DRA JUGUETE OTERO X2",0205000020
4499,"AFICHE BV DRAGON BALL OTERO",0205000021
4500,"AFICHE BV FRUTILLITA OTERO",0205000022
4501,"BANDERIN GRANJA GM",0205000023
4502,"AFICHE BV HS MUSICAL OTERO",0205000024
4503,"AFICHE BV HELLO KITY OTERO",0205000025
4509,"AFICHE BV HENRY MONST OTERO",0205000026
4510,"AFICHE BV LA GRANJA OTERO",0205000027
4511,"AFICHE BV PONY OTERO",0205000028
4512,"AFICHE BV MADAGASCAR OTERO X2",0205000029
4513,"AFICHE BV VILLANO FAV OTERO",0205000030
4514,"AFICHE BV MICKEY CLUB OTERO",0205000031
4515,"AFICHE BV MOANA OTERO",0205000033
4516,"AFICHE BV PEPPA PIG OTERO",0205000034
4517,"AFICHE BV PIRATAS CARIBE OTERO",0205000035
4518,"AFICHE BV PIRATAS OTERO X2",0205000036
4519,"AFICHE BV PLIM PLIM OTERO X2",0205000037
4520,"AFICHE BV PRINC SOFIA OTERO",0205000038
4521,"AFICHE FELICID PRINCESAS OTERO",0205000039
4522,"AFICHE BV PUCCA OTERO X2",0205000040
4523,"AFICHE BV SAPO PEPE OTERO",0205000041
4524,"AFICHE BV SAPO PEPE OTERO X2",0205000042
4525,"AFICHE BV SHREK OTERO",0205000043
4526,"AFICHE BV SOY LUNA OTERO",0205000044
4527,"AFICHE BV SPIDERMAN OTERO",0205000045
4528,"AFICHE BV SPIDERMAN OTERO X2",0205000046
4529,"AFICHE BV VIOLETTA OTERO X2",0205000047
4530,"AFICHE BV POOH OTERO",0205000048
4531,"AFICHE BV SAPA PEPA OTERO X2",0205000049
4532,"AFICHE BV SARAH KAY OTERO X2",0205000050
4533,"AFICHE NENA-NENE 1 AÑO DINP X1",0301000006
4534,"AFICHE DRAGON BALL OTERO",0205000051
4535,"AFICHE FC AMONG US OTERO",0205000052
4536,"AFICHE FC A BALLERINA OTERO X2",0205000053
4537,"AFICHE FC ANGRY BIRDS OTERO X2",0205000054
4538,"AFICHE FC AVENGERS OTERO",0205000055
4539,"AFICHE FC AVIONES OTERO",0205000056
4540,"AFICHE FC BAKUGAN OTERO X2",0205000057
4541,"AFICHE FC BARCELONA OTERO X2",0205000058
4542,"AFICHE FC DORY OTERO",0205000059
4543,"AFICHE FC CARS OTERO",0205000060
4544,"AFICHE FC COCO OTERO",0205000061
4545,"AFICHE FC CRY BABY OTERO",0205000062
4546,"AFICHE FC DOKI OTERO X2",0205000063
4547,"AFICHE FC DRA JUGUETE OTERO X2",0205000064
4548,"AFICHE FC DRAGON BALL OTERO",0205000065
4549,"AFICHE FC FROZEN OTERO",0205000066
4550,"AFICHE FC FRUTILLITA OTERO",0205000067
4551,"AFICHE FC FUTBOL OTERO",0205000068
4552,"AFICHE FC GRANJA GM",0205000069
4553,"AFICHE FC HENRY MONST OTERO",0205000070
4554,"AFICHE FC JURASSIC WORLD OTERO",0205000071
4555,"AFICHE FC LA GRANJA OTERO",0205000072
4556,"AFICHE FC SIRENITA OTERO",0205000073
4557,"AFICHE FC PONY OTERO",0205000074
4558,"AFICHE FC MADAGASCAR 3 OTEROX2",0205000075
4559,"AFICHE FC MARIPOSAS OTERO",0205000076
4560,"AFICHE FC MASHA Y EL OSO OTERO",0205000077
4561,"AFICHE FC MI VILLANO FAV OTERO",0205000078
4562,"AFICHE FC MICKEY OTERO",0205000079
4563,"AFICHE FC MINNIE OTERO",0205000080
4564,"AFICHE FC MOANA OTERO",0205000081
4565,"AFICHE FC PAW PATROL OTERO",0205000082
4566,"AFICHE FC PIRATAS OTERO X2",0205000083
4567,"AFICHE FC PJ MASKS OTERO",0205000084
4568,"AFICHE FC PLIM PLIM OTERO X2",0205000085
4569,"AFICHE FC PRINCESAS OTERO",0205000086
4570,"AFICHE FC PUCCA OTERO X2",0205000087
4571,"AFICHE FC SAPA PEPA OTERO X2",0205000088
4572,"AFICHE FC SAPO PEPE OTERO",0205000089
4573,"AFICHE FC SAPO PEPE OTERO X2",0205000090
4574,"AFICHE FC SARAH KAY OTERO X2",0205000091
4575,"AFICHE FC SONIC GM",0205000092
4576,"AFICHE FC SOY LUNA OTERO",0205000093
4577,"AFICHE FC TOY STORY OTERO",0205000096
4578,"AFICHE FC UNICORNIO DREAMS GM",0205000097
4579,"AFICHE FC VAMPIRINA OTERO",0205000098
4580,"AFICHE FC VAQUITA S A OTERO",0205000099
4581,"AFICHE FC VIOLETTA OTERO",0205000100
4582,"AFICHE FC VIOLETTA OTERO X2",0205000101
4583,"AFICHE FC ZOMBIE OTERO",0205000102
4584,"AFICHE FC LOL SURPRISE OTEROX2",0205000103
4585,"AFICHE PASAPARED",0201000006
4586,"AFICHE FC PEPPA PIG OTERO",0205000104
4587,"AFICHE HENRY MONST OTERO",0205000105
4588,"AFICHE MI VILLANO FAV OTERO",0205000106
4589,"AFICHE PEPPA PIG OTERO",0205000107
4590,"AFICHE SOY LUNA OTERO",0205000108
4591,"AGAR AGAR ALZOL X1KG",0105000004
4592,"AGAR AGAR ALZOL X500G",0105000005
4593,"AGARRADERA SILICONA MYM",0120000003
4594,"AGENDA MINI ANG BIRDS OTEROX10",0205000109
4595,"AGENDA MINI BARCELONA OTEROX10",0205000111
4596,"AGENDA MINI HENRY M OTEROX10",0205000114
4597,"AGENDA MINI SAPA PEPA OTEROX10",0205000119
4598,"AGENDA MINI SOY LUNA OTEROX10",0205000121
4602,"AGENDA MINI VIOLETTA OTEROX10",0205000124
4603,"MEZCLADOR TRAGO NEON PARTYSX50",0906000001
4604,"AGITADOR PLAST BO X50",0906000002
4605,"AGITADOR PLAST FLAMENCO CLX6",0906000003
4606,"AGITADOR PLAST KOV",0906000004
4607,"AJI MOLIDO HV X500G",0501000001
4608,"AJI MOLIDO HV X25KG",0501000002
4609,"AJO GRANULADO HV X12,5KG",0501000004
4610,"AJO GRANULADO HV X25KG",0501000005
4611,"AJO GRANULADO HV X500G",0501000007
4612,"ALAMBRE FORRADO BCO N 18 X5M",0701000001
4613,"ALAMBRE FORRADO BCO N 18 X10M",0701000002
4614,"ALAMBRE FORRADO BCO N 20 X5M",0701000003
4615,"ALAMBRE FORRADO BCO N 20 X20M",0701000004
4616,"ALAMBRE FORRADO BCO N 24 X5M",0701000005
4617,"ALAMBRE FORRADO BCO N 24 X30M",0701000006
4618,"ALAMBRE FORRADO BCO N 28 X5M",0701000007
4619,"ALAMBRE FORRADO BCO N 28 X45M",0701000008
4620,"ALAMBRE FORRADO VERDE N 18 X5M",0701000010
4621,"ALAMBRE FORRADO VERDE N 18X10M",0701000011
4622,"ALAMBRE FORRADO VERDE N 20 X5M",0701000012
4623,"ALAMBRE FORRADO VERDE N 20X20M",0701000013
4624,"ALAMBRE FORRADO VERDE N 24 X5M",0701000014
4625,"ALAMBRE FORRADO VERDE N 24X30M",0701000015
4626,"ALAMBRE FORRADO VERDE N 28 X5M",0701000016
4627,"ALAMBRE FORRADO VERDE N 28X45M",0701000017
4628,"ALAMBRE LISO 1MM AMARILLO X1",0701000018
4629,"ALAMBRE LISO 1MM AMARILLO X5",0701000019
4630,"ALAMBRE LISO 1MM AZUL X1",0701000020
4631,"ALAMBRE LISO 1MM AZUL X5",0701000021
4640,"ALAMBRE LISO 1MM CELESTE X1",0701000022
4641,"ALAMBRE LISO 1MM CELESTE X5",0701000023
4642,"ALAMBRE LISO 1MM FUCSIA X1",0701000024
4643,"ALAMBRE LISO 1MM FUCSIA X5",0701000025
4644,"ALAMBRE LISO 1MM LILA X1",0701000026
4645,"ALAMBRE LISO 1MM LILA X5",0701000027
4646,"ALAMBRE LISO 1MM NARANJA X1",0701000028
4647,"ALAMBRE LISO 1MM NARANJA X5",0701000029
4648,"ALAMBRE LISO 1MM NEGRO X1",0701000030
4649,"ALAMBRE LISO 1MM NEGRO X5",0701000031
4650,"ALAMBRE LISO 1MM ORO X6M",0701000032
4651,"ALAMBRE LISO 1.25MM ORO X5M",0701000033
4652,"ALAMBRE LISO 1.75MM ORO X3M",0701000034
4653,"ALAMBRE LISO 1.75MM ORO PAQ",0701000035
4654,"ALAMBRE LISO 1MM PLATA X6M",0701000036
4655,"ALAMBRE LISO 1.25MM PLATA X5M",0701000037
4656,"ALAMBRE LISO 1.75MM PLATA X3M",0701000038
4657,"ALAMBRE LISO 1.75MM PLATA PAQ",0701000039
4658,"ALAMBRE LISO 1MM ROJO X1",0701000040
4659,"ALAMBRE LISO 1MM ROJO X5",0701000041
4660,"ALAMBRE LISO 1MM ROSA X1",0701000042
4661,"ALAMBRE LISO 1MM ROSA X5",0701000043
4662,"ALAMBRE LISO 1MM TURQUESA X1",0701000044
4663,"ALAMBRE LISO 1MM TURQUESA X5",0701000045
4664,"ALAMBRE LISO 1MM VERDE X1",0701000046
4665,"ALAMBRE LISO 1MM VERDE X5",0701000047
4666,"ALAMBRE LISO 1MM VERDE MZNA X1",0701000048
4667,"ALAMBRE LISO 1MM VER MZNA X5",0701000049
4668,"ALAS ANGEL LUJO CHM",0203000001
4669,"ALAS ANGEL BCO PARTYS",0203000002
4671,"ALAS ANGEL NGO PARTYS",0203000003
4672,"ALAS ANGEL BCO REY X1",0203000004
4673,"ALAS ANGEL BCO REY X12",0203000005
4674,"ALAS ANGEL ORO REY X1",0203000006
4675,"ALAS ANGEL ORO REY X12",0203000007
4676,"ALAS ANGEL PLATA REY X1",0203000008
4677,"ALAS ANGEL PLATA REY X12",0203000009
4678,"ALAS ANGEL ORO TRIG X1",0203000010
4679,"ALAS ANGEL ORO TRIG X6",0203000011
4681,"ALAS ANGEL PLATA TRIG X1",0203000012
4682,"ALAS ANGEL PLATA TRIG X6",0203000013
4684,"ALAS C/PLUMAS BCO MYM",0203000014
4685,"ALAS C/PLUMAS NGO MYM",0203000015
4686,"ALAS HADA VERDE MYM",0203000016
4687,"ALAS HALLOWEEN RAP",0303000001
4688,"ALAS INSECTO MYM",0203000017
4689,"ALAS MARIPOSA MYM",0203000018
4690,"ALAS S/PLUMAS MYM",0203000019
4691,"ALBAHACA HV X500G",0501000008
4692,"ALFAJOR FRUTA GUAYMALLEN X38G",0802000011
4693,"ALFAJOR NGO GUAYMALLEN X38G",0802000012
4694,"ALFAJOR SIMP BCO TATIN X33G",0802000013
4695,"ALFAJOR SIMP NGO TATIN X33G",0802000015
4696,"ALFAJOR TRIPL BCO TATIN X60G",0802000018
4697,"ALFAJOR TRIPL NGO TATIN X60G",0802000019
4698,"ALIANZA PLAST ORO CA X50",0702000001
4699,"ALIANZA PLAST CA X1",0702000002
4700,"ALIZADOR INOX P/GANACHE MYM",0120000004
4701,"ALMENDRA X10KG",0110000001
4702,"ALMENDRA X22.68KG",0110000002
4712,"ALMOHADILLA P/FLORES BOTICA",0120000005
4713,"ALZA TORTAS MYM",0120000006
4714,"ANANA RODAJA GENTLEMAN X3KG",0109000001
4715,"ANANA RODAJA GENTLEMAN 6X3KG",0109000002
4716,"ANANA RODAJA SAN REMO X850G",0109000003
4717,"ANANA RODAJA SYP X3KG",0109000004
4718,"ANANA RODAJA SYP X850G",0109000005
4719,"ANANA TROZOS GENTLEMAN X3KG",0109000006
4720,"ANANA TROZOS GENTLEMAN 6X3KG",0109000007
4721,"ANANA TROZOS SAN REMO X3KG",0109000008
4722,"ANANA TROZOS SAN REMO X850G",0109000009
4723,"ANANA TROZOS SYP X3KG",0109000010
4724,"SET ANGELITO NENA LUJO CHM",0304000001
4725,"ANILLO CORAZON C/LUZ PARTYSX36",0202000004
4726,"ANILLO CORAZON C/LUZ PARTYS X1",0202000005
4727,"ANILLO CORONA C/LUZ PARTYS X36",0202000006
4728,"ANILLO CORONA C/LUZ PARTYS X1",0202000007
4729,"ANILLO DEDOS LASER PARTYS X4",0202000008
4730,"ANILLO EMOTICON LED PARTYS",0202000009
4731,"ANILLO ESTRELL C/LUZ PARTYSX36",0202000010
4732,"ANILLO ESTRELLA C/LUZ PARTYSX1",0202000011
4733,"ANILLO FRUTILL C/LUZ PARTYSX36",0202000012
4734,"ANILLO FRUTILLA C/LUZ PARTYSX1",0202000013
4735,"ANILLO HALLOWEN C/LUZ PARTYSX1",0202000014
4736,"ANILLO MARIQUITA LUZ PARTYSX36",0202000015
4737,"ANILLO MARIQUIT C/LUZ PARTYSX1",0202000016
4738,"ANILLO OJOS C/LUZ PARTYS X1",0202000017
4739,"ANILLO PAVO REAL LUZ PARTYSX48",0202000018
4740,"ANILLO PAVO REAL LUZ PARTYSX1",0202000019
4741,"ANILLO YOYO C/LUZ PARTYS X24",0202000020
4763,"ANILLO YOYO C/LUZ PARTYS X1",0202000021
4764,"ANIS EN GRANO HV X500G",0502000001
4765,"ANIS EN GRANO HV X25KG",0502000002
4766,"ANOTADOR ANGRY BIRDS OTERO X10",0205000126
4767,"ANOTADOR HENRY MONST OTERO X10",0205000131
4768,"ANOTADOR SOY LUNA OTERO X10",0205000137
4769,"ANOTADOR VIOLETA OTERO X10",0205000140
4770,"LENTES NEON AVIADOR PARTYS",0202000022
4771,"LENTES C/MOÑO LED PARTYS",0202000023
4772,"LENTES GTE CORAZON METAL MYM",0202000024
4773,"LENTES CORAZON ECO MYM",0202000025
4774,"LENTES CORAZON PARTYS",0202000026
4775,"LENTES NEON CORAZON PARTYS",0202000027
4776,"LENTES CORAZON RAYAS PARTYS",0202000028
4777,"LENTES CUADRADO ECO MYM",0202000029
4778,"LENTES CUADRADO LED PARTYS",0202000030
4779,"LENTES EMOTICON LED PARTYS",0202000031
4780,"LENTES GTE ERIKA MYM",0202000032
4781,"LENTES ESTRELLA ECO MYM",0202000033
4782,"LENTES ESTRELLA PARTYS",0202000034
4783,"LENTES NEON ESTRELLA PARTYS",0202000035
4784,"LENTES ESTRELL RAYA LED PARTYS",0202000036
4785,"LENTES GTE FLOGGER MYM",0202000037
4786,"LENTES FLOR ECO MYM",0202000038
4787,"LENTES NEON LENNON PARTYS",0202000039
4788,"LENTES MARIPOSA LED PARTYS",0202000040
4789,"LENTES MINERO LED MYM",0202000041
4790,"LENTES LED MYM",0202000042
4791,"LENTES ARAÑA LED PARTYS",0202000043
4792,"LENTES NARIPENE TRIG X6",0202000044
4799,"LENTES GTE OVALO MYM",0202000045
4800,"LENTES OVALO ECO MYM",0202000046
4801,"LENTES RAYAS LED PARTYS",0202000047
4802,"LENTES GTE RAYBAN MYM",0202000048
4803,"LENTES NEON RAYBAN CHM",0202000049
4804,"LENTES REDONDO PARTYS",0202000050
4805,"LENTES ROY LED PARTYS",0202000051
4806,"LENTES SEX PARTYS",0302000001
4807,"PIÑATA CARTON 1 AÑO DINP X1",0202000052
4808,"ANTIFAZ ANGRY BIRDS OTERO X10",0205000143
4809,"ANTIFAZ AVIONES OTERO X8",0205000145
4810,"ANTIFAZ BACKYARDIGANS OTERO X8",0205000146
4811,"ANTIFAZ BAKUGAN OTERO X10",0205000147
4812,"ANTIFAZ BALLERINA OTERO X10",0205000148
4813,"ANTIFAZ BARBIE OTERO X8",0205000149
4814,"ANTIFAZ BARCELONA OTERO X10",0205000150
4815,"ANTIFAZ BARNEY OTERO X8",0205000151
4816,"ANTIFAZ BCO LUN MULT OTERO X10",0205000152
4817,"ANTIFAZ BEN 10 OMNIV OTERO X8",0205000153
4818,"ANTIFAZ BEN 10 OTERO X8",0205000154
4819,"ANTIFAZ BOB ESPONJA OTERO X8",0205000155
4820,"ANTIFAZ BOCA TC X10",0205000156
4821,"ANTIFAZ DORY OTERO X8",0205000157
4822,"ANTIFAZ CAMPANITA OTERO X8",0205000158
4823,"ANTIFAZ CEBRA PARTYS",0202000053
4824,"ANTIFAZ CEBRITA ZOU OTERO X8",0205000161
4825,"ANTIFAZ CELEST LUNAR OTERO X10",0205000162
4826,"ANTIFAZ CHINO NGO TRIGX12",0202000054
4827,"ANTIFAZ COCO OTERO X10",0205000163
4828,"ANTIFAZ CRAQ CALADO PARTYS",0202000055
4835,"ANTIFAZ CRAQ BORD PLATA PARTYS",0202000056
4836,"ANTIFAZ CRY BABY OTERO X10",0205000164
4837,"ANTIFAZ DISNEY OTERO X8",0205000165
4838,"ANTIFAZ DRA JUGUETE OTERO X10",0205000167
4839,"ANTIFAZ GATITA BCO PARTYS",0202000057
4840,"ANTIFAZ GATITA NGO PARTYS",0202000058
4841,"ANTIFAZ GATITA ROJO PARTYS",0202000059
4842,"ANTIFAZ MARIPOSA ROJO PARTYS",0202000060
4843,"ANTIFAZ ENCAJE-STRASS PARTYS",0202000061
4844,"ANTIFAZ ZORRO NGO PARTYS",0202000062
4845,"ANTIFAZ ZORRO BCO PARTYS",0202000063
4846,"ANTIFAZ FLUO MYM X12",0202000064
4847,"ANTIFAZ FRUTILLITA OTERO X8",0205000170
4848,"ANTIFAZ GATUBELA TRIG X12",0202000066
4849,"ANTIFAZ GIBRE CALADO PARTYS",0202000067
4850,"ANTIFAZ GIBRE VENECIA PARTYS",0202000068
4851,"ANTIFAZ GLITTER ORO PARTYS X4",0202000069
4852,"ANTIFAZ GLITTER PLATA PARTYSX4",0202000070
4853,"ANTIFAZ ARAÑA HALLOW TRIG X12",0303000002
4854,"ANTIFAZ HANDY MANNY OTERO X8",0205000171
4855,"ANTIFAZ HELLO KITY OTERO X8",0205000172
4856,"ANTIFAZ HENRY MONST OTERO X10",0205000173
4857,"ANTIFAZ HOLOG PLUMA CHM X6",0202000071
4858,"ANTIFAZ HOLOG DECO GIBRE CHMX6",0202000072
4859,"ANTIFAZ HOLOG SIMPLE X6 CHM",0202000073
4860,"ANTIFAZ HOLOG MYM X12",0202000074
4861,"ANTIFAZ HOLOG SIMPLE TRIG X12",0202000075
4862,"ANTIFAZ HOT WHEELS OTERO X8",0205000174
4863,"ANTIFAZ IRON MAN OTERO X8",0205000175
4864,"ANTIFAZ JAKE PIRATAS OTERO X8",0205000176
4877,"ANTIFAZ JURASSIC W OTERO X10",0205000177
4878,"ANTIFAZ LA GRANJA OTERO X7",0205000178
4879,"ANTIFAZ SIRENITA OTERO X8",0205000179
4880,"ANTIFAZ ORLEANS LED PARTYS",0202000076
4881,"ANTIFAZ LEOPARDO PARTYS",0202000077
4882,"ANTIFAZ PONY OTERO X8",0205000180
4883,"ANTIFAZ LOONEY TS OTERO X8",0205000182
4884,"ANTIFAZ LOONEY TS TC X10",0205000183
4885,"ANTIFAZ PLUMAS C/LUZ PARTYS",0202000078
4886,"ANTIFAZ MISTERIO C/LUZ PARTYS",0202000079
4887,"ANTIFAZ MADAGASCAR 3 OTERO X10",0205000184
4888,"ANTIFAZ MARIPOSAS OTERO X8",0205000185
4889,"ANTIFAZ MOANA OTERO X10",0205000191
4890,"ANTIFAZ MONSTER HIGH OTERO X8",0205000192
4891,"ANTIFAZ MONSTER UNIV OTERO X8",0205000193
4892,"ANTIFAZ NGO LUN MULTI OTEROX10",0205000194
4893,"ANTIFAZ PHINEAS Y FERB OTEROX8",0205000197
4894,"ANTIFAZ PLAST BICOLOR PARTYS",0202000080
4895,"ANTIFAZ PLAST CALADO N1 PARTYS",0202000081
4896,"ANTIFAZ PLAST CALADO N2 PARTYS",0202000082
4897,"ANTIFAZ PLAST CALADO N3 PARTYS",0202000083
4898,"ANTIFAZ PLAST MARIPOSA PARTYS",0202000084
4899,"ANTIFAZ PLAST METALICO PARTYS",0202000085
4900,"ANTIFAZ POOH BABY OTERO X8",0205000201
4901,"ANTIFAZ PRINC SOFIA OTERO X8",0205000202
4902,"ANTIFAZ PUCCA OTERO X10",0205000205
4903,"ANTIFAZ RIGIDO PINTADO TRIG",0202000086
4904,"ANTIFAZ RIVER PLATE TC X10",0205000206
4905,"ANTIFAZ ROSA LUNAR OTERO X10",0205000207
4906,"ANTIFAZ SAPA PEPA OTERO X10",0205000208
4916,"ANTIFAZ SAPO PEPE OTERO X10",0205000209
4917,"ANTIFAZ SHERIFF CALLIE OTEROX8",0205000210
4918,"ANTIFAZ SHREK OTERO X8",0205000211
4919,"ANTIFAZ SMILEY GM X10",0205000212
4920,"ANTIFAZ SONIC GM X10",0205000213
4921,"ANTIFAZ SOY LUNA OTERO X10",0205000214
4922,"ANTIFAZ SUPERMAN OTERO X8",0205000216
4923,"ANTIFAZ TIGRE PARTYS",0202000087
4924,"ANTIFAZ TOM Y JERRY TC X10",0205000217
4925,"ANTIFAZ UNICORNIO DREAMS GMX10",0205000220
4926,"ANTIFAZ UNICORNIO GM X10",0205000221
4927,"ANTIFAZ VAQUITA S A OTERO X8",0205000223
4928,"ANTIFAZ VENECIA PLUMA MYM",0202000088
4929,"ANTIFAZ VENECIA GEMA-PLUMA MYM",0202000089
4930,"ANTIFAZ VENECIA GIBRE N1 MYM",0202000090
4931,"ANTIFAZ VENECIA GIBRE N2 MYM",0202000091
4932,"ANTIFAZ VENECIA METAL MYM",0202000092
4933,"ANTIFAZ VENECIA GIBRE TRIG",0202000093
4934,"ANTIFAZ VENECIA GIBRE BORD CHM",0202000094
4935,"ANTIFAZ VENECIA C/FLOR CHM",0202000095
4936,"ANTIFAZ VENECIA ENCAJE CHM",0202000096
4937,"ANTIFAZ VENECIA ENCAJ FLOR CHM",0202000097
4938,"ANTIFAZ VENECIA GIBRE CHM",0202000098
4939,"ANTIFAZ VENECIA LENTEJUELA CHM",0202000099
4940,"ANTIFAZ VENECIA DISEÑO CHM",0202000100
4941,"ANTIFAZ VENECIA BORD STRAS CHM",0202000101
4942,"ANTIFAZ VENECIA METAL FLOR CHM",0202000102
4943,"ANTIFAZ VENECIA METAL PLUM CHM",0202000103
4944,"ANTIFAZ VIOLETTA OTERO X10",0205000224
4945,"ANTIFAZ POOH OTERO X8",0205000225
4946,"ANTIFAZ ZETA TRIG X12",0202000104
4947,"FRAMBUESAS CONGELADO BIO X1KG",0109000011
4948,"SMOOTHIE FRUTI-DURAZ BIO X150G",0109000012
4949,"ARAÑA MEGA GTE PARTYS",0303000003
4950,"ARAÑA CHICA PARTYS",0303000004
4951,"ARAÑA GDE C/AMPOLLA PARTYS",0303000005
4952,"ARAÑA ROJA-NEGRA PARTYS",0303000006
4953,"ARAÑA TARANTULA GDE PARTYS",0303000007
4954,"DECO ARBOL 24 LED MYM",0201000012
4955,"DECO ARBOL 24 LED MYM",0201000013
4956,"DECO ARBOL 36 LED MYM",0201000014
4957,"DECO ARBOLITO NAVID ROJ PARTYS",0304000002
4958,"DECO ARBOLITO NAVID VER PARTYS",0304000003
4959,"ARITOS FRUTALES CHIL X7KG",0601000001
4960,"ARMADORES P/FLORES PARPEN X14",0114000001
4961,"ARMADORES P/FLORES PARPEN X3",0114000002
4962,"ARO CORTE PERFECTO BOTICA",0114000003
4963,"ARO HOJAL C/BORDE 10X3CM MULTY",0114000004
4964,"ARO HOJAL C/BORDE 11X3CM MULTY",0114000005
4965,"ARO HOJAL C/BORDE 12X3CM MULTY",0114000006
4966,"ARO HOJAL C/BORDE 3X3CM MULTY",0114000007
4967,"ARO HOJAL C/BORDE 4X3CM MULTY",0114000008
4968,"ARO HOJAL C/BORDE 5X3CM MULTY",0114000009
4969,"ARO HOJAL C/BORDE 6X3CM MULTY",0114000010
4970,"ARO HOJAL C/BORDE 7X3CM MULTY",0114000011
4971,"ARO HOJAL C/BORDE 8X3CM MULTY",0114000012
4972,"ARO HOJAL C/BORDE 9X3CM MULTY",0114000013
4973,"ASADERA CUADRADA N 22 MULTY",0114000014
4974,"ASADERA CUADRADA N 24 MULTY",0114000015
4975,"ASADERA CUADRADA N 26 MULTY",0114000016
4988,"ASADERA CUADRADA N 30 MULTY",0114000017
4989,"ASADERA RECT N 26 MULTY",0114000018
4990,"ASADERA RECT N 30 MULTY",0114000019
4991,"ASADERA RECT N 34 MULTY",0114000020
4992,"ASUSTA SUEGRA METAL CHM X100",0202000105
4993,"ASUSTA SUEGRA LARGO TRIG X6",0202000106
4994,"ASUSTA SUEGRA METAL TRIG X100",0202000107
4995,"ASUSTA SUEGRA ORO PARTYS X6",0202000108
4996,"ASUSTA SUEGRA R GOLD PARTYS X6",0202000109
4997,"ASUSTA SUEGRA PINK PARTYS X6",0202000110
4998,"ASUSTA SUEGRA SURT PARTYS X6",0202000111
4999,"ASUSTA SUEGRA MULTI PARTYS X6",0202000112
5000,"ASUSTA SUEGRA PLATA PARTYS X6",0202000113
5001,"ASUSTA SUEGRA LUNAR CHM X10",0202000114
5002,"ASUSTA SUEGRA C/FLECO TRIGX12",0202000115
5003,"ASUSTA SUEGRA C/SILBAT TRIGX36",0202000116
5004,"AUTOADHESIVO AMONG US OTERO",0205000226
5005,"AUTOADHESIVO CARS OTERO",0205000227
5006,"AUTOADHESIVO CRY BABY OTERO",0205000228
5007,"AUTOADHESIVO FROZEN OTERO",0205000229
5008,"AUTOADHESIVO JURASSIC W OTERO",0205000230
5009,"AUTOADHESIVO LA GRANJA OTERO",0205000231
5010,"AUTOADHESIVO SIRENITA OTERO",0205000232
5011,"AUTOADHESIVO LOL SURPR OTERO",0205000233
5012,"AUTOADHESIVO PAW PATROL OTERO",0205000234
5013,"AUTOADHESIVO PEPPA PIG OTERO",0205000235
5014,"AUTOADHESIVO PJ MASK OTERO",0205000236
5015,"AUTOADHESIVO PRINCESAS OTERO",0205000237
5016,"AVELLANA X15KG",0110000004
5017,"AVELLANA X10KG",0110000006
5031,"AZUCAR COMUN ARCOR X1KG",0101000001
5032,"AZUCAR COMUN CHANGO X1KG",0101000002
5033,"AZUCAR COMUN LEDESMA X1KG",0101000003
5034,"AZUCAR FLOR COCO GOD B Y X250G",0101000004
5035,"AZUCAR IMPAL AMARI ALZOL X1KG",0101000005
5036,"AZUCAR IMPAL AMARI ALZOL X500G",0101000006
5037,"AZUCAR IMPAL CELES ALZOL X1KG",0101000007
5038,"AZUCAR IMPAL CELES ALZOL X500G",0101000008
5039,"AZUCAR IMPAL ROSA ALZOL X1KG",0101000010
5040,"AZUCAR IMPAL ROSA ALZOL X500G",0101000011
5041,"AZUCAR IMPAL VERDE ALZOL X1KG",0101000012
5042,"AZUCAR IMPAL VERDE ALZOL X500G",0101000013
5043,"AZUCAR IMPAL HOLRAY X10KG",0101000014
5044,"AZUCAR IMPAL TALCO X1KG",0101000018
5045,"AZUCAR MASCABO ARCOR X500G",0101000020
5046,"AZUCAR NEGRA DEWEY X1KG",0101000023
5047,"AZUCAR RUBIA DEWEY 10X1KG",0101000029
5049,"AZUCAR RUBIA DEWEY X1KG",0101000030
5050,"AZUCAR RUBIA DEWEY X10KG",0101000031
5051,"AZUCAR IMPAL TAMIZADA X1KG",0101000034
