2225,"VASO POLIP RAYAS BCO-AMA SXX10",0910000212
2226,"VASO POLIP RAYAS BCO-AMA SXX40",0910000213
2227,"VASO POLIP SIRENA PARTYSX6",0910000216
2228,"VASO POLIP UNICORNIO PARTYSX6",0910000227
2229,"POSA HUEVO 50MM REPOST X1",0910000229
2230,"POSA HUEVO 70MM REPOST X1",0910000231
2231,"POSA HUEVO 95MM REPOST X1",0910000233
2232,"VASO TERMICO 120CC DART X100",0910000238
2233,"VASO TERMICO 120CC DART X25",0910000239
2234,"VASO TERMICO 120CC DART X1000",0910000240
2235,"VASO TERMICO 180CC DART X100",0910000241
2236,"VASO TERMICO 180CC DART X25",0910000242
2237,"VASO TERMICO 180CC DART X1000",0910000243
2238,"VASO TERMICO 240CC DART X100",0910000244
2239,"VASO TERMICO 240CC DART X25",0910000245
2240,"VASO TERMICO 240CC DART X1000",0910000246
2241,"VASO TERMICO 300CC DART X100",0910000247
2242,"VASO TERMICO 300CC DART X25",0910000248
2243,"VASO TERMICO 300CC DART X1000",0910000249
2244,"VASO TRAGO LARGO BAN X1",0910000251
2245,"VASO TRAGO LARGO LED PARTYS",0910000266
2246,"VASO TROPICAL 1000CC KRIS X1",0910000267
2270,"VASO TROPICAL 500CC KRIS X1",0910000270
2271,"VASO TROPICAL 800CC KRIS X1",0910000273
2272,"VASO WHISKY FACETEADO KOV X1",0910000276
2273,"VELA BENG HOLOG CAD 20X4",0207000036
2274,"VELA BENG HOLOG CAD 15X4",0207000037
2275,"VELA BENG HOLOG PARTYS 60X1",0207000040
2276,"VELA BENG HOLOG CAD X4",0207000041
2277,"VELA BENG HOLOG PARTYS X4",0207000042
2278,"VELA BENG HOLOG PARTYS X1",0207000043
2279,"VELA BOTINES-PELOTA PARTYS X5",0207000059
2280,"VELA BRILLO CELESTE N 0 PARTYS",0207000060
2281,"VELA BRILLO CELESTE N 1 PARTYS",0207000061
2282,"VELA BRILLO CELESTE N 2 PARTYS",0207000062
2283,"VELA BRILLO CELESTE N 3 PARTYS",0207000063
2284,"VELA BRILLO CELESTE N 4 PARTYS",0207000064
2285,"VELA BRILLO CELESTE N 5 PARTYS",0207000065
2286,"VELA BRILLO CELESTE N 6 PARTYS",0207000066
2287,"VELA BRILLO CELESTE N 7 PARTYS",0207000067
2288,"VELA BRILLO CELESTE N 8 PARTYS",0207000068
2289,"VELA BRILLO CELESTE N 9 PARTYS",0207000069
2290,"VELA BRILLOS BLANCO PARTYS X24",0207000070
2291,"VELA BRILLOS CELEST PARTYS X24",0207000071
2292,"VELA BRILLOS MAGENT PARTYS X24",0207000072
2293,"VELA BRILLOS NENA PARTYS X24",0207000073
2294,"VELA BRILLOS NENE PARTYS X24",0207000074
2295,"VELA BRILLOS ROSA N 1 PARTYS",0207000076
2296,"VELA BRILLOS ROSA N 2 PARTYS",0207000077
2297,"VELA BRILLOS ROSA N 3 PARTYS",0207000078
2298,"VELA BRILLOS ROSA N 4 PARTYS",0207000079
2299,"VELA BRILLOS ROSA N 5 PARTYS",0207000080
2330,"VELA BRILLOS ROSA N 6 PARTYS",0207000081
2331,"VELA BRILLOS ROSA N 7 PARTYS",0207000082
2332,"VELA BRILLOS ROSA N 8 PARTYS",0207000083
2333,"VELA BRILLOS ROSA N 9 PARTYS",0207000084
2334,"VELA BRILLOS ROSA PARTYS X24",0207000085
2335,"VELA BRILLOS VIOLET PARTYS X24",0207000086
2336,"VELA CHISPITA CELES N0 PARTYS",0207000170
2337,"VELA CHISPITA CELES N1 PARTYS",0207000171
2338,"VELA CHISPITA CELES N2 PARTYS",0207000172
2339,"VELA CHISPITA CELES N3 PARTYS",0207000173
2340,"VELA CHISPITA CELES N4 PARTYS",0207000174
2341,"VELA CHISPITA CELES N5 PARTYS",0207000175
2342,"VELA CHISPITA CELES N6 PARTYS",0207000176
2343,"VELA CHISPITA CELES N7 PARTYS",0207000177
2344,"VELA CHISPITA CELES N8 PARTYS",0207000178
2345,"VELA CHISPITA CELES N9 PARTYS",0207000179
2348,"VELA CHISPITA ORO N0 PARTYS",0207000182
2349,"VELA CHISPITA ORO N1 PARTYS",0207000183
2350,"VELA CHISPITA ORO N2 PARTYS",0207000184
2351,"VELA CHISPITA ORO N3 PARTYS",0207000185
2352,"VELA CHISPITA ORO N4 PARTYS",0207000186
2353,"VELA CHISPITA ORO N5 PARTYS",0207000187
2354,"VELA CHISPITA ORO N6 PARTYS",0207000188
2355,"VELA CHISPITA ORO N7 PARTYS",0207000189
2356,"VELA CHISPITA ORO N8 PARTYS",0207000190
2357,"VELA CHISPITA ORO N9 PARTYS",0207000191
2358,"VELA CHISPITA ROSA N0 PARTYS",0207000192
2359,"VELA CHISPITA ROSA N1 PARTYS",0207000193
2388,"VELA CHISPITA ROSA N2 PARTYS",0207000194
2389,"VELA CHISPITA ROSA N3 PARTYS",0207000195
2390,"VELA CHISPITA ROSA N4 PARTYS",0207000196
2391,"VELA CHISPITA ROSA N5 PARTYS",0207000197
2392,"VELA CHISPITA ROSA N6 PARTYS",0207000198
2393,"VELA CHISPITA ROSA N7 PARTYS",0207000199
2394,"VELA CHISPITA ROSA N8 PARTYS",0207000200
2395,"VELA CHISPITA ROSA N9 PARTYS",0207000201
2396,"VELA DECO ANGEL PARTYS",0207000207
2397,"VELA DECO BEBE CELEST PARTYS",0207000208
2398,"VELA DECO BEBE ROSA PARTYS",0207000209
2399,"VELA DECO CARRUAJE ROSA PARTYS",0207000210
2400,"VELA DECO TORRE EIFEL PARTYS",0207000215
2401,"VELA DECO UNICORNIO PARTYS",0207000216
2402,"VELA DEGRADE CELEST PARTYS X24",0207000217
2403,"VELA DEGRADE MAGENT PARTYS X24",0207000218
2404,"VELA DEGRADE VIOLET PARTYS X24",0207000219
2405,"VELA FINA GIBRE BCO PARTYS X12",0207000233
2406,"VELA FINA GIBRE CELE PARTYSX12",0207000235
2407,"VELA FINA GIBRE ORO PARTYSX12",0207000239
2408,"VELA FINA GIBRE ROSA PARTYSX12",0207000243
2409,"VELA IMP CORONA ROS-V PARTYSX8",0207000507
2410,"VELA IMP ESTRELLA AZU PARTYSX8",0207000508
2411,"VELA IMP GLOBO ROSA PARTYSX8",0207000509
2412,"VELA IMP PELOTA FUTB PARTYSX8",0207000510
2413,"VELA IRIDISCENTE NRO 0 PARTYS",0207000511
2414,"VELA IRIDISCENTE NRO 1 PARTYS",0207000512
2415,"VELA IRIDISCENTE NRO 2 PARTYS",0207000513
2416,"VELA IRIDISCENTE NRO 3 PARTYS",0207000514
2417,"VELA IRIDISCENTE NRO 4 PARTYS",0207000515
2445,"VELA IRIDISCENTE NRO 5 PARTYS",0207000516
2446,"VELA IRIDISCENTE NRO 6 PARTYS",0207000517
2447,"VELA IRIDISCENTE NRO 7 PARTYS",0207000518
2448,"VELA IRIDISCENTE NRO 8 PARTYS",0207000519
2449,"VELA IRIDISCENTE NRO 9 PARTYS",0207000520
2450,"VELA LARGA GIBRE CEL PARTYSX16",0207000572
2451,"VELA LARGA GIBRE MUL PARTYSX16",0207000573
2452,"VELA LARGA GIBRE ORO PARTYSX16",0207000574
2453,"VELA LARGA METAL ORO PARTYSX8",0207000576
2454,"VELA LARGA METAL PLAT PARTYSX8",0207000577
2455,"VELA LARGA METAL RO G PARTYSX8",0207000578
2456,"VELA LED N0 C/4 VELAS PARTYS",0207000579
2457,"VELA LED N1 C/4 VELAS PARTYS",0207000580
2458,"VELA LED N2 C/4 VELAS PARTYS",0207000581
2459,"VELA LED N3 C/4 VELAS PARTYS",0207000582
2460,"VELA LED N4 C/4 VELAS PARTYS",0207000583
2461,"VELA LED N5 C/4 VELAS PARTYS",0207000584
2462,"VELA LED N6 C/4 VELAS PARTYS",0207000585
2463,"VELA LED N7 C/4 VELAS PARTYS",0207000586
2464,"VELA LED N8 C/4 VELAS PARTYS",0207000587
2465,"VELA LED N9 C/4 VELAS PARTYS",0207000588
2466,"VELA MAGICA BLANCO PARTYS X10",0207000613
2467,"VELA MAGICA CELESTE PARTYS X10",0207000614
2468,"VELA MAGICA MAGENTA PARTYS X10",0207000615
2469,"VELA MAGICA MULTI PARTYS X10",0207000616
2470,"VELA MUSICAL CELESTE PARTYS",0207000626
2471,"VELA NOCHE 2CM PARTYS X25",0207000635
2472,"VELA NOCHE 2CM PARTYS X10",0207000636
2473,"VELA NRO 15 METAL ROSA PARTYS",0207000637
2474,"VELA NRO 25 METAL PLATA PARTYS",0207000638
2483,"VELA NRO 40 METAL ORO PARTYS",0207000641
2484,"VELA NRO 40 METAL PLATA PARTYS",0207000642
2485,"VELA NRO 50 METAL ORO PARTYS",0207000643
2486,"VELA NRO 50 METAL PLATA PARTYS",0207000644
2487,"VELA RAYADA CELESTE PARTYS X24",0207000830
2488,"VELA RAYADA MAGENTA PARTYS X24",0207000831
2489,"VELA RAYADA MULTIC PARTYS X24",0207000832
2490,"VELA RAYADA NENA PARTYS X24",0207000833
2491,"VELA RAYADA NENE PARTYS X24",0207000834
2492,"VELA RAYADA ROSA PARTYS X24",0207000835
2493,"VELA RAYADA VIOLETA PARTYS X24",0207000836
2494,"VELA BASQUET PARTYS SETX5",0207000864
2495,"VELA CARRERA AUTO PARTYS SETX5",0207000865
2496,"VELA COLA SIRENA PARTYS SETX5",0207000866
2497,"VELA CUPCAKE PARTYS SETX5",0207000867
2498,"VELA ESTRELLA PARTYS SETX5",0207000868
2499,"VELA FELIZ CUMP PARTYS SET X11",0207000869
2500,"VELA FUTBOL PARTYS SETX5",0207000870
2501,"VELA PIRATA PARTYS SETX5",0207000872
2502,"VELA PRINCESA PARTYS SETX5",0207000873
2503,"VELA PROPS PARTYS SETX5",0207000874
2504,"VELA SEX ADULTO PARTYS SETX5",0207000876
2505,"VELA SIRENITA PARTYS SETX5",0207000877
2506,"DISF VENDEDOR AMBUL T1 CANDE",0305000162
2507,"DISF VENDEDOR AMBUL T2 CANDE",0305000163
2508,"DISF VENDEDOR AMBUL T3 CANDE",0305000164
2509,"DISF VENDEDOR AMBUL T4 CANDE",0305000165
2510,"VINCHA ABEJA C/PLUMA PARTYS",0202000631
2511,"VINCHA AUREOLA BLANCO PARTYS",0203000444
2512,"VINCHA AUREOLA NEGRO PARTYS",0203000445
2532,"VINCHA BUNNY PELUCH LED PARTYS",0202000636
2533,"VINCHA CALAVERA AZUCAR PARTYS",0303000242
2534,"VINCHA CORONA HAPPY B PARTYS",0202000645
2535,"VINCHA CORONA ROS REINA PARTYS",0202000647
2536,"VINCHA CUCHILLA PARTYS",0303000243
2537,"VINCHA CUERNOS DIABLO PARTYS",0303000245
2538,"VINCHA DOBLE SANTA PARTYS",0304000029
2539,"VINCHA EGIPCIA ORO PARTYS",0203000448
2540,"VINCHA FIBRA OPTICA LED PARTYS",0202000657
2541,"VINCHA GATITA ROSA-NGO PARTYS",0203000449
2542,"VINCHA GLITTER ORO FC PARTYSX4",0202000661
2543,"VINCHA HAWAIANA LED PARTYS",0202000663
2544,"VINCHA HIPPIE LED PARTYS",0202000664
2545,"VINCHA HUESO PARTYS",0303000249
2546,"VINCHA LEOPARDO PARTYS",0203000451
2547,"VINCHA OREJA CONEJO LED PARTYS",0202000672
2548,"VINCHA OREJA BURRO TRIG X6",0202000673
2549,"VINCHA OREJA GATITA LED PARTYS",0202000674
2550,"VINCHA PUNK FIBRA LED PARTYS",0202000686
2551,"VINCHA PUNK PUAS LED PARTYS",0202000687
2552,"VINCHA RABBIT PELUCHE PARTYS",0203000453
2553,"VINCHA RASTAS LED PARTYS",0202000688
2554,"VINCHA RENO LUMINOSO PARTYS",0304000031
2555,"VINCHA RENO LENTEJUELA PARTYS",0304000032
2556,"VINCHA SERRUCHO PARTYS",0303000250
2557,"VINCHA SEX PARTYS",0302000038
2558,"VINCHA TIJERA PARTYS",0303000252
2559,"VINCHA UNICORNIO LED PARTYS",0202000701
2560,"VINCHA UNICORNIO MAGICO PARTYS",0202000702
2561,"VINCHA UNICORNIO ARCOIR PARTYS",0203000456
2589,"VINCHA UNICORNIO FLEQUI PARTYS",0203000457
2590,"VINCHA VENADO PARTYS",0304000034
2591,"ABANICO TELA ESTAMPADA FV",0202000001
2592,"ADHESIVO GEL COMEST PASTELAR",0105000002
2593,"AEROGRAFO DOBLE FUNCION PASTEL",0120000001
2594,"ALBUMINA POLVO PASTELAR X70G",0105000006
2595,"AZUCAR IMPAL LODISER X10KG",0101000015
2596,"AZUCAR IMPAL REFIN KEUKENX800G",0101000017
2597,"AZUCAR NEGRA CIRCE X10KG",0101000022
2598,"AZUCAR NEGRA LODISER X10KG",0101000025
2599,"AZUCAR RUBIA CIRCE X10KG",0101000027
2600,"BANDEJA DECORA HUEVO PK",0120000011
2601,"BAÑO ESPEJO PASTELAR X250G",0115000001
2602,"BAÑO MOLDEO BCO MAPRICOA",0102000001
2603,"BAÑO MOLDEO LECHE MAPRICOA",0102000002
2604,"BAÑO MOLDEO SEMIAMAR MAPRICOA",0102000003
2605,"BAÑO MOLDEO BLANCO MAPSA X500G",0102000004
2606,"BAÑO MOLDEO LECHE MAPSA X500G",0102000007
2607,"BAÑO MOLDEO SEMIAMA MAPSA X500",0102000010
2608,"BAÑO MOLDEO BCO CUBERSUIZ X1KG",0102000013
2609,"BAÑO MOLDEO C/L CUBERSUIZ X1KG",0102000015
2610,"BAÑO MOLDEO SEMI CUBERSUIZX1KG",0102000017
2611,"BAÑO MOLDEO S/AZUCAR CUBERSUIZ",0102000019
2612,"BAÑO MOLDEO BCO MEDAYINES X7KG",0102000024
2613,"BAÑO MOLDEO BCO MEDAYINES X1KG",0102000025
2614,"BAÑO MOLDEO C/L MEDAYINES X7KG",0102000028
2615,"BAÑO MOLDEO C/L MEDAYINES X1KG",0102000029
2616,"BAÑO MOLDEO SEMI MEDAYINESX1KG",0102000030
2617,"BAÑO MOLDEO SEMI MEDAYINESX7KG",0102000032
2618,"BAÑO MOLDEO BCO ALPINO X6KG",0102000033
2644,"BAÑO MOLDEO C/L ALPINO X6KG",0102000035
2645,"BAÑO MOLDEO SEMI ALPINO X6KG",0102000037
2646,"BAÑO MOLDEO C/L ALPINO X1KG",0102000040
2647,"BAÑO MOLDEO SEMI ALPINO X1KG",0102000042
2648,"BAÑO MOLDEO BCO ALPINO X1KG",0102000044
2649,"BAÑO MOLDEO BANANA ALPINOX500G",0102000045
2650,"BAÑO MOLDEO BLANCO ALPINOX500G",0102000047
2651,"BAÑO MOLDEO LECHE ALPINO X500G",0102000049
2652,"BAÑO MOLDEO DDLECH ALPINOX500G",0102000051
2653,"BAÑO MOLDEO FRUTIL ALPINOX500G",0102000053
2654,"BAÑO MOLDEO LIMON ALPINOX500G",0102000055
2655,"BAÑO MOLDEO MENTA ALPINOX500G",0102000057
2656,"BAÑO MOLDEO NARANJ ALPINOX500G",0102000059
2657,"BAÑO MOLDEO SEMI ALPINO X500G",0102000061
2658,"BAÑO MOLDEO BCO MAPRICOA X500G",0102000065
2659,"BAÑO MOLDEO BCO MAPRICOA X800G",0102000066
2660,"BAÑO MOLDEO LECHE MAPRICOAX500",0102000069
2661,"BAÑO MOLDEO LECHE MAPRICOAX800",0102000070
2662,"BAÑO MOLDEO SEMI MAPRICOAX500G",0102000073
2663,"BAÑO MOLDEO SEMI MAPRICOAX800G",0102000074
2664,"BAÑO REPOST BCO EASY CHOCX150G",0102000085
2665,"BAÑO REPOST C/L EASY CHOCX150G",0102000087
2666,"BAÑO REPOST SEM EASY CHOCX150G",0102000089
2667,"BAÑO P/CASCADA MEDAYINES X1KG",0102000092
2668,"BUTTERCREAM PASTELAR X2.5KG",0106000001
2669,"BUTTERCREAM CHAN PASTELARX360G",0106000002
2670,"BUTTERCREAM CHOC PASTELARX360G",0106000003
2671,"BUTTERCREAM FRUT PASTELARX360G",0106000004
2672,"CACAO AMARGO ALPINO X180G",0102000105
2673,"CACAO AMARGO KEUKEN X600G",0102000106
2701,"CACAO PRETO LODISER X25KG",0102000109
2702,"CACAO AMARGO MAPSA X1KG",0102000112
2703,"CARAMELO LIQUIDO CIRCE X1L",0115000003
2704,"GOTAS BLANCO ALPINO X1KG",0102000114
2705,"GOTAS DDLECHE ALPINO X1KG",0102000117
2706,"GOTAS SEMIAMARGO ALPINO X1KG",0102000121
2707,"CHIPS MINI SEMIAM LODISER X4KG",0102000122
2708,"COBERTURA 54% TRONADOR X400G",0102000131
2709,"CHOCOLATE ALMENDRA COFLER X55G",0802000086
2710,"CHOCOLATE OREO MILKA X55G",0802000106
2711,"CHOCOLATIN CHOCO SAPITO DISPL",0802000124
2712,"CHOCOLITO BCO MAPRICOA X1KG",0102000136
2713,"CHOCOLITO C/LECH MAPRICOA X1KG",0102000139
2714,"CHOCOLITO SEMI MAPRICOA X150G",0102000143
2715,"CHOCOLITO MINI MAPRICOA X1KG",0102000146
2716,"LATEX FX CICATRIZ TORN PARTYS",0303000075
2717,"CINTA BANDERA N 1 CTEX X10M",0305000019
2718,"CINTA BANDERA N 12 CTEX X10M",0305000020
2719,"CINTA BANDERA N 2 CTEX X10M",0305000021
2720,"CINTA BANDERA N 3 CTEX X10M",0305000022
2721,"CINTA BANDERA N 5 CTEX X10M",0305000023
2722,"CINTA BANDERA N 9 CTEX X10M",0305000024
2723,"CINTA BANDERA N 011 BALLOUX40M",0305000025
2724,"CINTA BANDERA N 07 BALLOU X50M",0305000026
2725,"CINTA BANDERA C/LUREX N 5 CTEX",0305000027
2726,"CINTA BANDERA C/LUREX N 9 CTEX",0305000028
2727,"CINTA 011 ROSA BALLOUX50M",0905000018
2728,"CINTA 05 DORADO BALLOUX50M",0905000067
2729,"CINTA ORGANICA P/GLOBOS GBOX",0204000012
2730,"COLGANTE BRUJA NAR 60CM PARTYS",0303000078
2755,"COLGANTE BRUJA NGO-VIOL PARTYS",0303000079
2756,"COLGANTE BRUJA VIO 60CM PARTYS",0303000080
2757,"COLGANTE CALABAZA NEGRO PARTYS",0303000081
2758,"COLGANTE CALAVERA NEGRO PARTYS",0303000083
2759,"COLGANTE CALAVERA NOVIO PARTYS",0303000084
2760,"COLGANTE ESQUELET ANGEL PARTYS",0303000086
2761,"COLGANTE ESQUELETO 90CM PARTYS",0303000087
2762,"COLGANTE TELEARAÑA PARTYS",0303000088
2763,"COLGANTE FANTASMA BCO PARTYS",0303000089
2764,"ADORNO P/MESA PERSONAJE TUKY",0201000193
2765,"COLGANTE MURCIELAGO CH PARTYS",0303000091
2766,"COLGANTE MURCIELAGO GDE PARTYS",0303000092
2767,"COLGANTE PAYASO NGO-ROJ PARTYS",0303000093
2768,"COLGANTE ST MUERTE BCO PARTYS",0303000094
2769,"COLGANTE ST MUERTE ROSA PARTYS",0303000095
2770,"COLGANTE SCREAM BCO PARTYS",0303000096
2771,"COLLAR AJO ANTIVAMPIRO PARTYS",0303000097
2772,"COLLAR CAVERNICOLA PARTYS",0303000098
2773,"COLLAR HAWAI TELA CHM X12",0202000242
2774,"COLLAR NEON BICOLOR PARTYS X25",0303000099
2775,"COLLAR SMILE LED PARTYS",0202000255
2776,"COLORANTE SPRAY AMARILL WILTON",0108000001
2777,"COLORANTE SPRAY AZUL WILTON",0108000002
2778,"COLORANTE SPRAY BLANCO WILTON",0108000003
2779,"COLORANTE SPRAY DORADO WILTON",0108000004
2780,"COLORANTE SPRAY NARANJA WILTON",0108000005
2781,"COLORANTE SPRAY NEGRO WILTON",0108000006
2782,"COLORANTE SPRAY PLATA WILTON",0108000007
2783,"COLORANTE SPRAY ROJO WILTON",0108000008
2784,"COLORANTE SPRAY ROSA WILTON",0108000009
2797,"COLORANTE SPRAY VERDE WILTON",0108000010
2798,"COLORANTE SPRAY VIOLETA WILTON",0108000011
2799,"COLORANTE KIT ARCOIRIS DELIX60",0108000012
2800,"COLORANTE RED VELVET DELI X60G",0108000013
2801,"COLORANTE CREM ROYAL BLUE DELI",0108000014
2802,"COLORANTE CREM ALMOND DELI",0108000015
2803,"COLORANTE CREM BRONZE DELI",0108000016
2804,"COLORANTE CREM CHAMPAGNE DELI",0108000017
2805,"COLORANTE CREM FUCHSIA DELI",0108000018
2806,"COLORANTE CREM TANGERINE DELI",0108000019
2807,"COLORANTE CREM WHITE GOLD DELI",0108000020
2808,"COLORANTE CREM GOLD PURE DELI",0108000021
2809,"COLORANTE CREM ROSE GOLD DELI",0108000022
2810,"COLORANTE CREM RED STRAWB DELI",0108000023
2811,"COLORANTE CREM GRAPEFRUIT DELI",0108000024
2812,"COLORANTE CREM GREEN FORESDELI",0108000025
2813,"COLORANTE AMARILLO DOR WILTON",0108000026
2814,"COLORANTE AMARILLO LIM WILTON",0108000027
2815,"COLORANTE AMARILLO ORO WILTON",0108000028
2816,"COLORANTE AZUL WILTON",0108000029
2817,"COLORANTE AZUL DELF WILTON",0108000030
2818,"COLORANTE AZUL REAL WILTON",0108000031
2819,"COLORANTE COBRE WILTON X29.3G",0108000033
2820,"COLORANTE GEL KIT WILTON X4",0108000034
2821,"COLORANTE FUCSIA WILTON X29.3G",0108000035
2822,"COLORANTE MARRON WILTON X29.3G",0108000036
2823,"COLORANTE NARANJA WILTONX29.3G",0108000037
2824,"COLORANTE NEGRO WILTON X29.3G",0108000038
2825,"COLORANTE ROJO INT WILTONX29.3",0108000039
2826,"COLORANTE ROJO NAV WILTONX29.3",0108000040
2857,"COLORANTE ROJO WILTON X29.3G",0108000041
2858,"COLORANTE ROSA G WILTON X29.3G",0108000042
2859,"COLORANTE TURQUES WILTONX29.3G",0108000043
2860,"COLORANTE VERDE H WILTONX29.3G",0108000044
2861,"COLORANTE VERDE MUSGO WILTON",0108000045
2862,"COLORANTE LIQ AMAR CIRCE X1L",0108000047
2863,"COLORANTE LIQ AMAR CIRCE X2L",0108000048
2864,"COLORANTE LIQ AMAR CIRCE X5L",0108000049
2865,"COLORANTE LIQ AZUL CIRCE X1L",0108000053
2866,"COLORANTE LIQ CARAM CIRCE X1L",0108000056
2867,"COLORANTE LIQ ROJO CIRCE X1L",0108000059
2868,"COLORANTE LIQ VERDE CIRCE X1L",0108000061
2869,"COLORANTE LIQ AVELLANA DELI",0108000063
2870,"COLORANTE LIQ CORAL DELI",0108000064
2871,"COLORANTE LIQ EUCALIPTO DELI",0108000065
2872,"COLORANTE LIQ INDIGO DELI",0108000066
2873,"COLORANTE LIQ NARCISO DELI",0108000067
2874,"COLORANTE LIQ ONIX DELI",0108000068
2875,"COLORANTE LIQ SANDIA DELI",0108000069
2876,"COLORANTE LIQ TOPACIO DELI",0108000070
2877,"COLORANTE LIQ VERDE AGUA DELI",0108000071
2878,"COLORANTE LIQ VERDE BOSQ DELI",0108000072
2879,"COLORANTE AMARILLO BLOCH X15G",0108000108
2880,"COLORANTE AZUL BLOCH X15G",0108000109
2881,"COLORANTE BLANCO BLOCH X15G",0108000110
2882,"COLORANTE BORDO BLOCH X15G",0108000111
2883,"COLORANTE CELESTE BLOCH X15G",0108000112
2884,"COLORANTE CELESTE P BLOCH X15G",0108000113
2885,"COLORANTE FUCSIA BLOCH X15G",0108000114
2886,"COLORANTE NARANJA BLOCH X15G",0108000116
2917,"COLORANTE NEGRO BLOCH X15G",0108000117
2918,"COLORANTE ROJO BLOCH X15G",0108000118
2919,"COLORANTE ROSA BLOCH X15G",0108000119
2920,"COLORANTE SALMON BLOCH X15G",0108000120
2921,"COLORANTE VERDE BLOCH X15G",0108000121
2922,"COLORANTE VERDE H BLOCH X15G",0108000122
2923,"COLORANTE VIOLETA BLOCH X15G",0108000124
2924,"COLORANTE LILA BLOCH X15G",0108000125
2925,"COLORANTE TURQUESA BLOCH X15G",0108000126
2926,"COLORANTE AMARILLO CIRCE X15G",0108000128
2927,"COLORANTE AZUL M CIRCE X15G",0108000131
2928,"COLORANTE AZUL CIRCE X15G",0108000132
2929,"COLORANTE BLANCO CIRCE X15G",0108000134
2930,"COLORANTE CELESTE CIRCE X15G",0108000136
2931,"COLORANTE LILA CIRCE X15G",0108000139
2932,"COLORANTE MARRON CIRCE X15G",0108000141
2933,"COLORANTE NARANJA CIRCE X15G",0108000143
2934,"COLORANTE NEGRO CIRCE X15G",0108000145
2935,"COLORANTE PLATA CIRCE X15G",0108000147
2936,"COLORANTE ROJO BORD CIRCE X15G",0108000150
2937,"COLORANTE ROJO R CIRCE X15G",0108000152
2938,"COLORANTE ROJO CIRCE X15G",0108000153
2939,"COLORANTE ROSA B CIRCE X15G",0108000155
2940,"COLORANTE ROSA P CIRCE X15G",0108000156
2941,"COLORANTE SALMON CIRCE X15G",0108000159
2942,"COLORANTE TURQUESA CIRCE X15G",0108000161
2943,"COLORANTE VERDE A CIRCE X15G",0108000164
2944,"COLORANTE VERDE H CIRCE X15G",0108000166
2945,"COLORANTE VERDE CIRCE X15G",0108000167
2946,"COLORANTE VIOLETA CIRCE X15G",0108000169
2977,"COLORANTE NACAR BCO SEDA DELI",0108000170
2978,"COLORANTE NACAR GRAFITO DELI",0108000171
2979,"COLORANTE NACAR GRIS CUAR DELI",0108000172
2980,"COLORANTE NEON AMARILLO DELI",0108000173
2981,"COLORANTE NEON AZUL DELI",0108000174
2982,"COLORANTE NEON PURPURA DELI",0108000175
2983,"COLORANTE NEON NARANJA DELI",0108000176
2984,"COLORANTE NEON ROJO DELI",0108000177
2985,"COLORANTE NEON ROSA DELI",0108000178
2986,"COLORANTE NEON VERDE DELI",0108000179
2987,"COLORANTE NACAR ORO BCO DELI",0108000180
2988,"COLORANTE ORO FINO DELI",0108000181
2989,"COLORANTE ORO MEDIO DELI",0108000182
2990,"COLORANTE NACAR ORO NGO DELI",0108000183
2991,"COLORANTE POLVO HADAS DELI",0108000184
2992,"COLORANTE NACAR ROSA GOLD DELI",0108000185
2993,"COLORANTE HIDROS AMARILLO DELI",0108000186
2994,"COLORANTE HIDROS NARANJA DELI",0108000187
2995,"COLORANTE HIDROS AZUL BR DELI",0108000188
2996,"COLORANTE HIDROS AZUL MAR DELI",0108000189
2997,"COLORANTE HIDROS BLANCO DELI",0108000190
2998,"COLORANTE HIDROS CELESTE DELI",0108000191
2999,"COLORANTE HIDROS LILA AZA DELI",0108000192
3000,"COLORANTE HIDROS NGO HUMO DELI",0108000193
3001,"COLORANTE HIDROS ROJO CH DELI",0108000194
3002,"COLORANTE HIDROS ROJO COR DELI",0108000195
3003,"COLORANTE HIDROS ROSA TRI DELI",0108000197
3004,"COLORANTE HIDROS VERDE H DELI",0108000198
3005,"COLORANTE HIDROS VERDE V DELI",0108000199
3006,"COLORANTE LIPOS ACERO DELI",0108000200
3037,"COLORANTE LIPOS AGUA DELI",0108000201
3038,"COLORANTE LIPOS ALMENDRA DELI",0108000202
3039,"COLORANTE LIPOS AMARILLO DELI",0108000203
3040,"COLORANTE LIPOS AZUL FRAN DELI",0108000204
3041,"COLORANTE LIPOS AZUL OCEA DELI",0108000205
3042,"COLORANTE LIPOS BLANCO DELI",0108000206
3043,"COLORANTE LIPOS CELESTE P DELI",0108000207
3044,"COLORANTE LIPOS CORAL DELI",0108000208
3045,"COLORANTE LIPOS EUCALIPTO DELI",0108000209
3046,"COLORANTE LIPOS FUCSIA DELI",0108000210
3047,"COLORANTE LIPOS GRIS PERL DELI",0108000211
3048,"COLORANTE LIPOS HIELO DELI",0108000212
3049,"COLORANTE LIPOS LAVANDA DELI",0108000213
3050,"COLORANTE LIPOS LILA DELI",0108000214
3051,"COLORANTE LIPOS MALBEC DELI",0108000215
3052,"COLORANTE LIPOS MALVA DELI",0108000216
3053,"COLORANTE LIPOS NARANJA DELI",0108000217
3054,"COLORANTE LIPOS NEGRO DELI",0108000218
3055,"COLORANTE LIPOS REMOLACHA DELI",0108000219
3056,"COLORANTE LIPOS ROJO GRAN DELI",0108000220
3057,"COLORANTE LIPOS ROJO TOM DELI",0108000221
3058,"COLORANTE LIPOS ROSA DELI",0108000222
3059,"COLORANTE LIPOS ROSA P DELI",0108000223
3060,"COLORANTE LIPOS SALVIA DELI",0108000224
3061,"COLORANTE LIPOS TERRACOTA DELI",0108000225
3062,"COLORANTE LIPOS TURQUESA DELI",0108000226
3063,"COLORANTE LIPOS VERDE A DELI",0108000227
3064,"COLORANTE LIPOS VERDE DELI",0108000228
3065,"COLORANTE LIPOS VERDE LIM DELI",0108000229
3066,"COLORANTE LIPOS VERDE MAR DELI",0108000230
3097,"COLORANTE LIPOS VIOLETA DELI",0108000231
3098,"COLORANTE CARBON VEG PASTELAR",0108000232
3099,"COLORANTE LIPOS AMARILL TCLASS",0108000233
3100,"CONFITE PLATA NRO 1 CIRCE X1KG",0104000011
3101,"CONFITE PLATA NRO 2 CIRCE X1KG",0104000012
3102,"CONFITE PLATA NRO 3 CIRCE X1KG",0104000013
3103,"CONFITE PLATA NRO 4 CIRCE X1KG",0104000014
3104,"CONFITE PLATA NRO 5 CIRCE X1KG",0104000015
3105,"CONFITE PLATA NRO 6 CIRCE X1KG",0104000016
3106,"CORTANTE GALLETA CUADRADA LWC",0114000339
3107,"CREMA PASTELERA KEUKEN X1KG",0106000023
3108,"CREMA PASTELERA KEUKEN X250G",0106000024
3109,"CREMA CHANTILLY LEDEVIT X5KG",0106000030
3110,"CREMA CHANTILLY LEDEVIT X1KG",0106000031
3111,"CREMA CHANTILLY LEDEVIT X500G",0106000033
3112,"CREMA CHOCOLATE LEDEVIT X1KG",0106000037
3113,"CREMA CHOCOLATE LEDEVIT X4.5KG",0106000038
3114,"CREMA CHOCOLATE LEDEVIT X500G",0106000039
3115,"CREMA FRUTILLA LEDEVIT X1KG",0106000043
3116,"CREMA FRUTILLA LEDEVIT X500G",0106000045
3117,"CREMA PARIS LEDEVIT X280G",0106000047
3118,"CREMA PASTELERA LEDEVIT X250G",0106000049
3119,"CREMA VAINILLA LEDEVIT X5KG",0106000054
3120,"CREMA VAINILLA LEDEVIT X1KG",0106000055
3121,"CREMA VAINILLA LEDEVIT X500G",0106000057
3122,"CREMA CHANTILLY ALZOL X1KG",0106000058
3123,"CREMA VEGETAL ULTRA RICHS X1L",0106000063
3124,"CREMOR TARTARO ALZOL X1KG",0105000013
3125,"DESHIDRATADOR PASTELAR",0120000307
3126,"DIOXIDO DE TITANIO PASTELAR",0108000244
3144,"DISF CONEJO ROSA T3 CANDE",0203000172
3145,"DISF DOCTOR NIÑO T1 CANDE",0203000180
3146,"DISF DOCTOR NIÑO T2 CANDE",0203000181
3147,"DISF DOCTOR NIÑO T3 CANDE",0203000182
3148,"DISF ENFERMERA NIÑA T1 CANDE",0203000185
3149,"DISF ENFERMERA NIÑA T2 CANDE",0203000186
3150,"DISF ENFERMERA NIÑA T3 CANDE",0203000187
3151,"DISF GOKU NIÑO T1 CANDE",0203000195
3152,"DISF GOKU NIÑO T2 CANDE",0203000196
3153,"DISF GOKU NIÑO T3 CANDE",0203000197
3154,"DISF GOKU NIÑO T4 CANDE",0203000198
3155,"DISF MARINERO NIÑO T0 CANDE",0203000221
3156,"DISF MARINERO NIÑO T1 CANDE",0203000222
3157,"DISF MARINERO NIÑO T2 CANDE",0203000223
3158,"DISF MARINERO NIÑO T3 CANDE",0203000224
3159,"DISF MONO NIÑO T1 CANDE",0203000230
3160,"DISF MONO NIÑO T2 CANDE",0203000231
3161,"DISF MONO NIÑO T3 CANDE",0203000232
3162,"DISF PAYASO NIÑO T1 CANDE",0203000241
3163,"DISF PAYASO NIÑO T2 CANDE",0203000242
3164,"DISF PAYASO NIÑO T3 CANDE",0203000243
3165,"DISF PAYASO NIÑO T4 CANDE",0203000244
3166,"DISF PIRATA NIÑO T0 CANDE",0203000254
3167,"DISF VAQUERA T2 CANDE",0203000275
3168,"DISF BRUJA C/PAILLETE T2 CANDE",0303000104
3169,"DISF BRUJA C/PAILLETE T1 CANDE",0303000105
3170,"DISF DIABLA C/VINCHA T2 CANDE",0303000113
3171,"DISF MUJER ARAÑA ESP T1 CANDE",0303000134
3172,"DISF MUJER ARAÑA ESP T2 CANDE",0303000135
3173,"DROPS GLITTER ESTRELL PASTELAR",0104000021
3175,"PERLA MAXI AQUA PASTELAR X35G",0104000022
3176,"PERLA MAXI AMAR PASTELAR X35G",0104000023
3177,"PERLA MAXI BCO PASTELAR X35G",0104000024
3178,"PERLA MAXI CORAL PASTELAR X35G",0104000025
3179,"PERLA MAXI DORADO PASTELARX35G",0104000026
3180,"PERLA MAXI FUCSIA PASTELARX35G",0104000028
3181,"PERLA MAXI ROJO PASTELAR X35G",0104000030
3182,"PERLA MAXI ROSA PASTELAR X35G",0104000032
3183,"PERLA MAXI TURQ PASTELARX35G",0104000034
3184,"PERLA MINI AMAR PASTELAR X35G",0104000036
3185,"PERLA MINI AZUL PASTELAR X35G",0104000037
3186,"PERLA MINI BCO PASTELAR X35G",0104000039
3187,"PERLA MINI CELES PASTELAR X35G",0104000041
3188,"PERLA MINI CORAL PASTELAR X35G",0104000043
3189,"PERLA MINI DORADO PASTELARX35G",0104000045
3190,"PERLA MINI FUCSIA PASTELARX35G",0104000047
3191,"PERLA MINI NEGRO PASTELAR X35G",0104000048
3192,"PERLA MINI PURPUR PASTELARX35G",0104000050
3193,"PERLA MINI ROJO PASTELAR X35G",0104000051
3194,"PERLA MINI VERDE PASTELAR X35G",0104000052
3195,"PERLA MED AMAR PASTELAR X35G",0104000059
3196,"PERLA MED BCO PASTELAR X35G",0104000060
3197,"PERLA MED CELES PASTELAR X35G",0104000061
