15,"PLACA MOLDEO COD A 618 PK",0117000270
16,"PLACA MOLDEO COD A 617 PK",0117000269
17,"AC COCO MCT SPRAY GOD B Y",0119000001
18,"AC COCO NEUTRO GOD B Y X125ML",0119000002
19,"AC COCO NEUTRO GOD B Y X1L",0119000003
20,"AC COCO NEUTRO GOD B Y X225ML",0119000004
21,"AC COCO NEUTRO GOD B Y X500ML",0119000005
22,"AC COCO VIRGEN GOD B Y X125ML",0119000006
23,"AC COCO VIRGEN GOD B Y X1L",0119000007
24,"AC COCO VIRGEN GOD B Y X225ML",0119000008
25,"AC COCO VIRGEN GOD B Y X500ML",0119000009
26,"ADORNO ESCARAPELA TRK X4",0305000001
27,"ADORNO P/FOTO FROZEN OTERO",0205000001
28,"ADORNO P/FOTO SIRENITA OTERO",0205000002
29,"ADORNO P/FOTO TOY STORY OTERO",0205000004
30,"AEROGRAFO MANUAL C/4TUBOS LWC",0120000002
31,"AFICHE BARBIE OTERO",0205000006
32,"AFICHE BV CARS OTERO",0205000017
33,"AFICHE FC SPIDERMAN OTERO",0205000094
34,"AFICHE FC SPIDERMAN OTERO X2",0205000095
35,"AGENDA MINI AVENGERS OTEROX10",0205000110
36,"AGENDA MINI DR JUGUET OTEROX10",0205000112
37,"AGENDA MINI DRAGON B OTEROX10",0205000113
38,"AGENDA MINI VILLANO F OTEROX10",0205000115
39,"AGENDA MINI PEPPA PIG OTEROX10",0205000116
40,"AGENDA MINI PJ MASKS OTEROX10",0205000117
41,"AGENDA MINI PLIM PLIM OTEROX10",0205000118
42,"AGENDA MINI SAPO PEPE OTEROX10",0205000120
43,"AGENDA MINI SPIDERMAN OTEROX10",0205000122
44,"AGENDA MINI VAMPIRINA OTEROX10",0205000123
75,"AGENDA MINI ZOMBIE OTEROX10",0205000125
76,"ALFAJOR BALCARCITO X24G",0802000001
77,"ALFAJOR BALCARCITO 24X24G",0802000002
78,"ALFAJOR LA RECOVA 6X60G",0802000003
79,"ALFAJOR MINITORTA BROWN AGUILA",0802000004
80,"ALFAJOR MINITORTA COCO AGUILA",0802000005
81,"ALFAJOR MINITORTA TRAD AGUILA",0802000006
82,"ALFAJOR BCO GUAYMALLEN X38G",0802000007
83,"ANOTADOR DOKI OTERO X10",0205000128
84,"ANOTADOR DRA JUGUETE OTERO X10",0205000129
85,"ANOTADOR DRAGON BALL OTERO X10",0205000130
86,"ANOTADOR PEPPA PIG OTERO X10",0205000133
87,"ANOTADOR PJ MASKS OTERO X10",0205000134
88,"ANOTADOR PLIM PLIM OTERO X10",0205000135
89,"ANOTADOR SAPO PEPE OTERO X10",0205000136
90,"ANOTADOR SPIDERMAN OTERO X10",0205000138
91,"ANOTADOR VAMPIRINA OTERO X10",0205000139
92,"ANOTADOR ZOMBIE OTERO X10",0205000141
93,"ANTIFAZ AMONG US OTERO X10",0205000142
94,"ANTIFAZ AVENGERS OTERO X7",0205000144
95,"ANTIFAZ CARS 2 OTERO X8",0205000159
96,"ANTIFAZ CARS OTERO X10",0205000160
97,"ANTIFAZ DOKI OTERO X10",0205000166
98,"ANTIFAZ DRAGON BALL OTERO X10",0205000168
99,"ANTIFAZ FROZEN OTERO X10",0202000065
100,"ANTIFAZ FROZEN OTERO X8",0205000169
101,"ANTIFAZ LOL SURPRISE OTERO X10",0205000181
102,"ANTIFAZ VILLANO FAV OTERO X10",0205000186
103,"ANTIFAZ MICKEY OTERO X6",0205000187
104,"ANTIFAZ MICKEY OTERO X8",0205000188
135,"ANTIFAZ MINNIE OTERO X6",0205000189
136,"ANTIFAZ MINNIE OTERO X8",0205000190
137,"ANTIFAZ PAW PATROL OTERO X10",0205000195
138,"ANTIFAZ PEPPA PIG OTERO X10",0205000196
139,"ANTIFAZ PIRATAS OTERO X10",0205000198
140,"ANTIFAZ PJ MASKS OTERO X10",0205000199
141,"ANTIFAZ PLIM PLIM OTERO X10",0205000200
142,"ANTIFAZ PRINCESAS OTERO X10",0205000203
143,"ANTIFAZ PRINCESAS OTERO X8",0205000204
144,"ANTIFAZ SPIDERMAN OTERO X10",0205000215
145,"ANTIFAZ TOY STORY OTERO X8",0205000218
146,"ANTIFAZ TOY STORY OTERO X10",0205000219
147,"ANTIFAZ VAMPIRINA OTERO X8",0205000222
148,"BANDERIN AMONG US OTERO",0205000244
149,"BANDERIN AVENGERS OTERO",0205000248
150,"BANDERIN CARS OTERO",0205000254
151,"BANDERIN COCO OTERO",0205000255
152,"BANDERIN DOKI OTERO",0205000257
153,"BANDERIN SIRENITA OTERO",0205000267
154,"BANDERIN MI VILLANO FAV OTERO",0205000272
155,"BANDERIN MICKEY CLUB OTERO",0205000273
156,"BANDERIN PAW PATROL OTERO",0205000275
157,"BANDERIN PEPPA PIG OTERO",0205000277
158,"BANDERIN PIRATAS OTERO",0205000279
159,"BANDERIN PJ MASKS OTERO",0205000280
160,"BANDERIN PLIM PLIM OTERO",0205000281
161,"BANDERIN PRINCESAS OTERO",0205000283
162,"BANDERIN ZOMBIE OTERO",0205000295
163,"BOLSA AMONG US OTERO X10",0205000300
164,"BOLSA AVENGERS OTERO X10",0205000302
193,"BOLSA CARS OTERO X10",0205000319
194,"BOLSA CRY BABY OTERO X10",0205000323
195,"BOLSA DOKI OTERO X10",0205000325
196,"BOLSA DRAGON BALL OTERO X10",0205000327
197,"BOLSA ESTUCHE PRINCESA OTEROX8",0205000328
198,"BOLSA FROZEN OTEROX10",0205000331
199,"BOLSA VILLANO FAV OTEROX10",0205000357
200,"BOLSA MICKEY OTEROX10",0205000358
201,"BOLSA MINNIE OTEROX10",0205000359
202,"PIROTIN N10 VACA MOLP",0901000185
203,"PIROTIN N10 A PRINT MOLP",0901000186
204,"PIROTIN N10 ANIMAL GRANJA MOLP",0901000187
205,"PIROTIN N10 AUTITOS MOLP",0901000188
206,"PIROTIN N10 BBSHOWER NENA MOLP",0901000189
207,"PIROTIN N10 BUHO MOLP",0901000191
208,"PIROTIN N10 COMICS MOLP",0901000192
209,"PIROTIN N10 CORAZON FUCS MOLP",0901000193
210,"PIROTIN N10 CUPCAKE C/BCO MOLP",0901000194
211,"PIROTIN N10 CUPCAKE C/MAR MOLP",0901000195
212,"PIROTIN N10 CUPCAKE ESPIR MOLP",0901000196
213,"PIROTIN N10 DINOSAURIO MOLP",0901000197
214,"PIROTIN N10 EGRESADO MOLP",0901000198
215,"PIROTIN N10 EMOJIS MOLP",0901000199
216,"PIROTIN N10 ESTRELLA MOLP",0901000200
217,"PIROTIN N10 FELIZ DIA MOLP",0901000201
218,"PIROTIN N10 FLAMENCO MOLP",0901000202
219,"PIROTIN N10 FLORES MOLP",0901000203
220,"PIROTIN N10 FUTBOL MOLP",0901000204
221,"PIROTIN N10 LEOPARDO MOLP",0901000205
222,"PIROTIN N10 LIBERTY MOLP",0901000206
252,"PIROTIN N10 LLAMA MOLP",0901000207
253,"PIROTIN N10 LOVE MOLP",0901000208
254,"PIROTIN N10 LUNA CELEST MOLP",0901000209
255,"PIROTIN N10 LUNA ROSA MOLP",0901000210
256,"PIROTIN N10 MANDALA MOLP",0901000211
257,"PIROTIN N10 NIEVE MOLP",0901000212
258,"PIROTIN N10 PAPA NOEL MOLP",0901000213
259,"PIROTIN N10 PSICODELICO MOLP",0901000214
260,"PIROTIN N10 RASTIS MOLP",0901000215
261,"PIROTIN N10 ROSA ROSENE MOLP",0901000216
262,"PIROTIN N10 SHABBY CHIC MOLP",0901000217
263,"PIROTIN N10 SIRENITA MOLP",0901000218
264,"BOQUILLA CHICA N 00 PARPEN X1",0120000032
265,"BOQUILLA CHICA N 007 PARPEN X1",0120000033
266,"CHOCOLITO SEMI MAPRICOA X1KG",0102000141
267,"COLORANTE LIPOS AZUL TCLASS",0108000234
268,"COLORANTE LIPOS BLANCO TCLASS",0108000235
269,"COLORANTE LIPOS CELESTE TCLASS",0108000236
270,"COLORANTE LIPOS CIRUELA TCLASS",0108000237
271,"COLORANTE LIPOS NARANJA TCLASS",0108000238
272,"COLORANTE LIPOS NEGRO TCLASS",0108000239
273,"COLORANTE LIPOS ROJO TCLASS",0108000240
274,"COLORANTE LIPOS ROSA TCLASS",0108000241
275,"COLORANTE LIPOS VERDE TCLASS",0108000242
276,"COLORANTE LIPOS VIOLETA TCLASS",0108000243
277,"CORTANTE CLAVEL LWC SETX3",0114000114
278,"CORTANTE METAL CIRCULOS LWC",0114000368
279,"CORTANTE METAL VARIOS LWC",0114000378
280,"CORTINA METAL CROMO CELE P DX",0201000212
281,"CORTINA METAL HOLOG NGO DX",0201000213
312,"CORTINA METAL HOLOG ORO FIN DX",0201000214
313,"CORTINA METAL CROMO ORO P DX",0201000215
314,"CORTINA METAL CROMO PLATA P DX",0201000216
315,"CORTINA METAL BRILLANT ROSA DX",0201000217
316,"CORTINA METAL CROMO ROSA P DX",0201000220
317,"CORTINA METAL LASER AZUL DX",0201000221
318,"CORTINA METAL LASER CELESTE DX",0201000222
319,"CORTINA METAL LASER ORO DX",0201000223
320,"CORTINA METAL LASER PLATA DX",0201000224
321,"CORTINA METAL LASER PURPURA DX",0201000225
322,"CORTINA METAL LASER ROJO DX",0201000226
323,"CORTINA METAL LASER VERDE DX",0201000227
324,"CORTINA METAL CIRCULO AZUL LWC",0201000228
325,"CORTINA METAL CIRCULO FUCS LWC",0201000229
326,"CORTINA METAL CIRCULO ORO LWC",0201000230
327,"CORTINA METAL CIRCULO PLAT LWC",0201000231
328,"CORTINA METAL CORAZON FUCS LWC",0201000233
329,"CORTINA METAL CORAZON ORO LWC",0201000234
330,"CORTINA METAL CORAZON PLAT LWC",0201000235
331,"CORTINA METAL CORAZON ROJO LWC",0201000236
332,"CORTINA METAL CORAZ ROSA G LWC",0201000237
333,"CORTINA METAL ESTRELLA ORO LWC",0201000239
334,"CORTINA METAL ESTRELL PLAT LWC",0201000240
335,"CORTINA METAL ESTRE ROSA G LWC",0201000242
336,"CORTINA METAL LASER FUCSIA LWC",0201000243
337,"CORTINA METAL AZUL LWC",0201000244
338,"CORTINA METAL ORO LWC",0201000245
339,"CORTINA METAL FUCSIA LWC",0201000246
340,"CORTINA PASTEL CELESTE LWC",0201000252
341,"CORTINA PASTEL DEGRADE LWC",0201000253
372,"CORTINA PASTEL LILA LWC",0201000254
373,"CORTINA SATINADA AZUL LWC",0201000256
374,"CORTINA SATINADA FUCSIA LWC",0201000257
375,"CORTINA SATINADA NEGRO LWC",0201000258
376,"CORTINA SATINADA ORO LWC",0201000259
377,"CORTINA SATINADA PLARA LWC",0201000260
378,"CORTINA SATINADA ROSA LWC",0201000261
379,"CORTINA SATINADA ROSA G LWC",0201000262
380,"CUCHARA BOCHA HELADO INOX LWC",0120000299
381,"DULCE DE LECHE EL MUNDO X10KG",0107000010
382,"DULCE DE LECHE EL MUNDO X3KG",0107000011
384,"DULCE DE LECHE LANFIELD X10KG",0107000014
385,"DULCE DE LECHE LANFIELD X3KG",0107000015
386,"DULCE DE LECHE LANFIELD X5KG",0107000016
387,"DULCE DE LECHE LEDEVIT X5KG",0107000018
388,"ESENCIA AROMA QUESO DEWEY X1L",0108000319
389,"ESENCIA LIMON DEWEY X1L",0108000322
390,"F.DURAZNO GDE AZUL JAZ X60",0116000018
391,"F.DURAZNO GDE BLANCO JAZ X60",0116000019
392,"F.DURAZNO GDE ROJO JAZ X60",0116000025
393,"F.DURAZNO GDE ROSA JAZ X60",0116000026
394,"F.DURAZNO MED C/H MULTI JAZX50",0116000036
395,"F.DURAZNO MED ROJO JAZ X100",0116000050
396,"F.DURAZNO MINI MULTIC JAZ X200",0116000073
397,"F.ROSA MED C/H MULTIC JAZ X20",0116000163
398,"F.ROSA MED LILA JAZ X25",0116000172
399,"GLOBO 12""PAST AMARIL GBOX CAJA",0204000053
400,"GLOBO 12""PAST CELESTE GBOX X50",0204000054
401,"GLOBO 12""PAST CELEST GBOX CAJA",0204000055
425,"GLOBO 12""PAST LILA GBOX CAJA",0204000056
426,"GLOBO 12""PAST LILA GBOX X50",0204000057
427,"GLOBO 12""PERL ROSA PTIME X25",0204000062
428,"GLOBO 12""PERL AZUL FR PTIMEX25",0204000074
429,"GLOBO 12""PERL ORO PTIME X25",0204000124
430,"GLOBO 12""PERL PLATA PTIME X25",0204000130
431,"GLOBO 12""PERL SURTIDO PTIMEX25",0204000153
432,"GLOBO 12""PERL VERDE M PTIMEX25",0204000165
433,"GLOBO 9""PAST AMARILL PTIME X25",0204000228
434,"GLOBO 9""PAST LILA PTIME X25",0204000230
435,"GLOBO 9""PAST ROSA PTIME X25",0204000231
436,"GLOBO 9""PAST SURTIDO PTIME X25",0204000232
437,"GLOBO 9""PAST VERDE PTIME X25",0204000233
438,"GLOBO 9""ST AMARILLO PTIME X50",0204000270
439,"GLOBO 9""ST AZUL PTIME X50",0204000271
440,"GLOBO 9""ST BLANCO PTIME X50",0204000272
441,"GLOBO 9""ST CELESTE PTIME X50",0204000273
442,"GLOBO 9""ST FC SURTIDO PTIMEX50",0204000275
443,"GLOBO 9""ST FLUO SURT PTIME X25",0204000276
444,"GLOBO 9""ST FUCSIA PTIME X50",0204000277
445,"GLOBO 9""ST NARANJA PTIME X50",0204000279
446,"GLOBO 9""ST NEGRO PTIME X50",0204000280
447,"GLOBO 9""ST ROJO PTIME X50",0204000281
448,"GLOBO 9""ST SURTIDO PTIME X50",0204000283
449,"GLOBO 9""ST VERDE MZN PTIME X50",0204000284
450,"GLOBO 9""ST VERDE OSC PTIME X50",0204000285
451,"GLOBO 9""ST VIOLETA PTIME X50",0204000286
452,"GOTAS MICRO BLANCO MAPSA X1KG",0102000150
453,"GOTAS MICRO SEMIAM MAPSA X1KG",0102000152
454,"GOTAS MINI BLANCO MAPSA X1KG",0102000154
508,"GOTAS MINI SEMIAM MAPSA X1KG",0102000158
509,"GRAGEA N 2 AMARILL DECORM X50G",0104000073
510,"GRAGEA N 2 AZUL DECORM X50G",0104000074
511,"GRAGEA N 2 BLANCO DECORM X50G",0104000075
512,"GRAGEA N 2 CELESTE DECORM X50G",0104000076
513,"GRAGEA N 2 LILA DECORM X50G",0104000077
514,"GRAGEA N 2 M AMERIC DECORMX50G",0104000078
515,"GRAGEA N 2 NARANJA DECORM X50G",0104000080
516,"GRAGEA N 2 NEGRO DECORM X50G",0104000081
517,"GRAGEA N 2 PLATA DECORM X50G",0104000082
518,"GRANA AMARILLO DECORM X50G",0104000178
519,"GRANA AMARILLO DECORM X1KG",0104000179
520,"GRANA AZUL DECORM X50G",0104000180
521,"GRANA AZUL DECORM X1KG",0104000181
522,"GRANA BLANCO DECORM X1KG",0104000183
523,"GRANA CELESTE DECORM X50G",0104000184
524,"GRANA CELESTE DECORM X1KG",0104000185
525,"GRANA CHOCOLATE DECORM X50G",0104000186
526,"GRANA CHOCOLATE DECORM X1KG",0104000187
527,"GRANA LILA DECORM X50G",0104000190
528,"GRANA LILA DECORM X1KG",0104000191
529,"GRANA MARRON DECORM X50G",0104000192
530,"GRANA MARRON DECORM X1KG",0104000193
531,"GRANA MULTICOLOR DECORM X50G",0104000196
532,"GRANA MULTICOLOR DECORM X1KG",0104000197
533,"GRANA NARANJA DECORM X50G",0104000198
534,"GRANA NARANJA DECORM X1KG",0104000199
535,"GRANA NEGRO DECORM X50G",0104000200
536,"GRANA NEGRO DECORM X1KG",0104000201
537,"GRANA PLATA DECORM X50G",0104000202
568,"GRANA PLATA DECORM X1KG",0104000203
569,"GRANA ROJO DECORM X50G",0104000204
570,"GRANA ROJO DECORM X1KG",0104000205
571,"GRANA ROSA DECORM X50G",0104000206
572,"GRANA ROSA PAST DECORM X50G",0104000207
573,"GRANA ROSA PAST DECORM X1KG",0104000208
574,"GRANA ROSA DECORM X1KG",0104000209
575,"GRANA TURQUESA DECORM X50G",0104000210
576,"GRANA TURQUESA DECORM X1KG",0104000211
577,"GRANA VERDE CL DECORM X50G",0104000212
578,"GRANA VERDE CL DECORM X1KG",0104000213
579,"GRANA VERDE OSC DECORM X50G",0104000214
580,"GRANA CORAZON TURQ DECORM X50G",0104000215
581,"GRANA VIOLETA DECORM X50G",0104000216
582,"GRANA VIOLETA DECORM X1KG",0104000217
583,"HOJAS TROPICALES TRK X8",0201000434
584,"MANI C/CASC TOST MKING X500G",0602000004
585,"MANI C/SAL MKING X500G",0602000005
586,"MANI C/SAL MKING X1KG",0602000008
587,"MANI C/SAL MKING X5KG",0602000009
588,"MANI C/CHOCOLATE MKING X80G",0802000149
589,"MANI S/SAL TOST MKING X500G",0602000011
590,"MANTECA LA PAULINA X200G",0111000005
591,"MANTECA MANI C/CHOC MKINGX350G",0115000012
592,"MANTECA MANI ORIG MKING X350G",0115000014
593,"MARGARINA MANTECA REVECA X5KG",0111000016
594,"MARGARINA MASA CORDOBESA X1KG",0111000019
595,"MARGARINA MASA CORDOBESA X10KG",0111000021
596,"MARGARINA MASA PASTRIMAR CAJA",0111000022
597,"MARGARINA MASA PASTRIMAR X10KG",0111000023
628,"PASTAFROLA ALUM FIJA N24 MULTY",0114000476
629,"PASTAFROLA ALUM FIJA N26 MULTY",0114000477
630,"PASTAFROLA ALUM FIJA N28 MULTY",0114000478
631,"PASTAFROLA ALUM FIJA N32 MULTY",0114000480
632,"MOLDE ALUM RED DESM N 14 MULTY",0114000485
633,"MOLDE ALUM RED DESM N 16 MULTY",0114000486
634,"MOLDE ALUM RED DESM N 18 MULTY",0114000487
635,"MOLDE ALUM RED DESM N 20 MULTY",0114000488
636,"MOLDE ALUM RED DESM N 22 MULTY",0114000489
637,"MOLDE ALUM RED DESM N 24 MULTY",0114000490
638,"MOLDE ALUM RED DESM N 26 MULTY",0114000491
639,"MOLDE ALUM RED DESM N 28 MULTY",0114000492
640,"MOLDE ALUM RED DESM N 30 MULTY",0114000493
641,"MOLDE BUDIN ALUM N 4 MULTY",0120000417
642,"MOLDE BUDIN ALUM N 5 MULTY",0120000418
643,"MOLDE BUDIN ALUM N 6 MULTY",0120000419
644,"MOLDE BUDIN HOJAL 14X8CM MULTY",0120000420
645,"MOLDE BUDIN HOJAL 16X8CM MULTY",0120000421
646,"MOLDE BUDIN HOJAL 20X10CM MULT",0120000422
647,"MOLDE BUDIN HOJAL 20X8CM MULTY",0120000423
648,"MOLDE BUDIN HOJAL 24X10CM MULT",0120000424
649,"MOLDE BUDIN HOJAL 28X10CM MULT",0120000425
650,"MOLDE CANOLI MULTY",0120000426
651,"MOLDE CAPELINA MULTY",0114000538
652,"MOLDE CORAZON ALUM N 1 MULTY",0120000427
653,"MOLDE CORAZON ALUM N 2 MULTY",0120000428
654,"MOLDE CORAZON ALUM N 3 MULTY",0120000429
655,"MOLDE CORAZON ALUM N 4 MULTY",0120000430
656,"MOLDE CORAZON BOMBE MULTY",0120000431
657,"MOLDE ESCUDO FUTBOL ALUM MULTY",0120000432
686,"MOLDE PERICO MULTY",0114000593
687,"MOLDE ISLA FLOTANTE ALUM MULTY",0120000433
688,"PASTAFROLA DESM N 10 MULTY",0114000618
689,"PASTAFROLA DESM N 12 MULTY",0114000619
690,"PASTAFROLA DESM N 14 MULTY",0114000620
691,"PASTAFROLA DESM N 16 MULTY",0114000621
692,"PASTAFROLA DESM N 18 MULTY",0114000622
693,"PASTAFROLA DESM N 20 MULTY",0114000623
694,"PASTAFROLA DESM N 22 MULTY",0114000624
695,"PASTAFROLA DESM N 24 MULTY",0114000625
696,"PASTAFROLA N 10 MULTY",0114000631
697,"PASTAFROLA FIJA N 12 MULTY",0114000632
698,"PASTAFROLA FIJA N 14 MULTY",0114000633
699,"PASTAFROLA FIJA N 16 MULTY",0114000634
700,"PASTAFROLA FIJA N 18 MULTY",0114000635
701,"PASTAFROLA FIJA N 8 MULTY",0114000643
702,"PASTAFROLA FIJA 35X10CM MULTY",0114000660
703,"PASTAFROLA FIJA GRANDE MULTY",0114000663
704,"PASTA AMER AMARI DECOR X500G",0115000016
705,"PASTA AMER BCO DECOR X1KG",0115000021
706,"PASTA AMER BCO DECOR X2,8KG",0115000022
707,"PASTA AMER BCO DECOR X500G",0115000023
708,"PASTA AMER CELES DECOR X500G",0115000025
709,"PASTA AMER FUCS DECOR X500G",0115000027
710,"PASTA AMER MARRON DECOR X500G",0115000029
711,"PASTA AMER NARAN DECOR X500G",0115000031
712,"PASTA AMER NEGRO DECOR X3.5KG",0115000033
713,"PASTA AMER ROJO DECOR X3.5KG",0115000036
714,"PASTA AMER ROJO DECOR X500G",0115000037
715,"PASTA AMER CESPED DECOR X500G",0115000041
746,"PASTA AMER VIOLET DECOR X500G",0115000044
747,"PASTA RELL CHOCO MAPSA X450G",0115000120
748,"PASTA RELL ARANDANO TCLASS",0115000133
749,"PASTA RELL AVELLANA TCLASS",0115000134
750,"PASTA RELL BANANA TCLASS",0115000135
751,"PASTA RELL CHOCOCROC TCLASS",0115000136
752,"PASTA RELL COCO TCLASS",0115000137
753,"PASTA RELL COOKIES TCLASS",0115000138
754,"PASTA RELL FRAMBUESA TCLASS",0115000139
755,"PASTA RELL FRUTILLA TCLASS",0115000140
756,"PASTA RELL MANGO TCLASS",0115000142
757,"PASTA RELL MANI TCLASS",0115000143
758,"PASTA RELL MANTECOL TCLASS",0115000144
759,"PASTA RELL MARACUYA TCLASS",0115000145
760,"PASTA RELL MARROC TCLASS",0115000146
761,"PASTA RELL MELON TCLASS",0115000147
762,"PASTA RELL MENTA TCLASS",0115000148
763,"PASTA RELL NUTECHOC TCLASS",0115000149
764,"PASTA RELL PISTACHO TCLASS",0115000150
765,"PASTA RELL SAMBAYON TCLASS",0115000151
766,"PASTA RELL TIRAMISU TCLASS",0115000152
767,"PASTA RELL VAINILLA TCLASS",0115000153
768,"PINCHE BBSHOW CUADRILLE TRK X1",0201000488
769,"PINCHE BBSHOW CUADRILLE TRK X5",0201000489
771,"PINCHE BBSHOWER LUNAR TRK X1",0201000490
772,"PINCHE BBSHOWER LUNAR TRK X5",0201000491
774,"PINCHE BBSHOWER CELESTE TRK X1",0201000492
775,"PINCHE BBSHOWER CELESTE TRK X6",0201000493
777,"PINCHE BBSHOWER ROSA TRK X6",0201000494
779,"PINCHE COMUNION ANGEL TRK X8",0201000502
810,"PINCHE COMUNION ANGEL TRK X1",0201000503
811,"PINCHE COMUNION VIRGEN TRK X1",0201000504
812,"PINCHE COMUNION VIRGEN TRK X8",0201000505
814,"PINCHE EGRESADOS ORO TRK X6",0201000510
816,"PINCHE EGRESADOS NEGRO TRK X6",0201000511
818,"PINCHE PLAST ESCUDO BOCA TRKX6",0201000513
819,"PINTAPELO AMARILLO CANDELA",0202000484
820,"PINTAPELO AZUL CANDELA",0202000485
821,"PINTAPELO BLANCO CANDELA",0202000486
822,"PINTAPELO CELESTE CANDELA",0202000487
823,"PINTAPELO ORO CANDELA",0202000488
824,"PINTAPELO NARANJA CANDELA",0202000489
825,"PINTAPELO NEGRO CANDELA",0202000490
826,"PINTAPELO PLATA CANDELA",0202000491
827,"PINTAPELO PURPURA CANDELA",0202000492
828,"PINTAPELO ROJO CANDELA",0202000493
829,"PINTAPELO ROSA CANDELA",0202000494
830,"PINTAPELO VERDE CANDELA",0202000495
831,"PIROTIN N8 LUN GDE MULTI  MOLP",0901000304
832,"PIROTIN N8 NGO LUN ROJO MOLP",0901000305
833,"PIROTIN N8 LUNA ROSA MOLP",0901000307
834,"PIROTIN N8 AMA LUN CHICO MOLP",0901000308
835,"PIROTIN N8 AZUL LUN CHICO MOLP",0901000309
836,"PIROTIN N8 CELE LUN CHICO MOLP",0901000310
837,"PIROTIN N8 FUCS LUN CHICO MOLP",0901000311
838,"PIROTIN N8 NARAN LUN CHIC MOLP",0901000312
839,"PIROTIN N8 NGO LUN CHICO MOLP",0901000313
840,"PIROTIN N8 ROJO LUN CHICO MOLP",0901000314
841,"PIROTIN N8 ROSA LUN CHICO MOLP",0901000315
842,"PIROTIN N8 VERD LUN CHICO MOLP",0901000317
873,"PIROTIN N8 VIOL LUN CHICO MOLP",0901000318
874,"PIROTIN N8 AMAR LUN GDE MOLP",0901000319
875,"PIROTIN N8 AZUL LUN GDE MOLP",0901000320
876,"PIROTIN N8 CELES LUN GDE MOLP",0901000321
877,"PIROTIN N8 FUCS LUN GDE MOLP",0901000322
878,"PLACA 290 PARPEN",0117000022
879,"PLACA 347 PARPEN",0117000025
880,"PLACA 647 PARPEN",0117000051
881,"PLACA 649 PARPEN",0117000053
882,"PLACA CHUPETIN 653 PARPEN",0117000056
883,"PLACA 655 PARPEN",0117000057
884,"PLACA 656 PARPEN",0117000058
885,"PLACA HUEVO AE1 PARPEN",0117000455
886,"PLACA HUEVO AE2 PARPEN",0117000456
887,"PLACA HUEVO AE3 PARPEN",0117000457
888,"PLACA HUEVO AE4 PARPEN",0117000458
889,"PLACA HUEVO AMN PARPEN",0117000459
890,"POCHOCLERA LISA AMARILLO CLX10",0904000128
891,"POCHOCLERA LISA CELESTE CL X10",0904000129
892,"POCHOCLERA LISA ROJO CL X10",0904000130
893,"POCHOCLERA LISA ROSA CL X10",0904000131
894,"POCHOCLERA AMARIL LUNAR CLX10",0904000132
895,"POCHOCLERA BCO LUNAR MULTCLX10",0904000133
896,"CAJAS P/ 4 CUPCAKES CL",0904000135
897,"POCHOCLERA ROJ LUNAR NGO CLX10",0904000136
898,"POCHOCLERA ROSA LUNAR CLX10",0904000137
899,"POCHOCLERA LUN-RAY CELE CLX10",0904000138
900,"POCHOCLERA RAYAS CEL-BCO CLX10",0904000142
901,"POCHOCLERA RAYAS ROJ-BCO CLX10",0904000145
902,"POCHOCLERA RAYAS ROS-BCO CLX10",0904000146
933,"POCHOCLERA RAYAS VER-BCO CLX10",0904000147
934,"POSTRE MANI LHERITIER X1KG",0115000157
935,"SALSA CARAMELO LHERITIER X500G",0115000168
936,"SALSA CHOCO LHERITIER X500G",0115000171
937,"SALSA CHOCO LHERITIER X200G",0115000172
938,"SALSA DDLECHE LHERITIER X200G",0115000175
939,"SALSA DDLECHE LHERITIER X500G",0115000176
940,"SALSA FRUTILLA LHERITIER X200G",0115000179
941,"SALSA FRUTILLA LHERITIER X500G",0115000180
942,"SALSA F.ROJOS LHERITIER X200G",0115000182
943,"GLOBO LATEX LENTEJUELA CHM X5",0201000867
944,"SET GLOBO CORAZ CONF MULTI DX",0204000478
945,"SET GLOBO CORAZ CONF ROJO DX",0204000479
946,"SET GLOBO CORAZ CONF ROSA DX",0204000480
947,"SET GLOBO GTE CONF ORO DX",0204000482
948,"SET GLOBO GTE CONF PLATA DX",0204000483
949,"SET MYLAR PAW PATROL LWC X5",0204000521
950,"SET MYLAR SILUET LOL UNICORLWC",0204000523
951,"SET MYLAR SPIDERMAN LWC X5",0204000526
952,"SET MYLAR TIKTOK LWC X5",0204000527
953,"SET PINCEL CHM X3",0120000511
954,"SET PINCEL-ESPATULA ANCHO CHM",0120000513
955,"SORBETE POLIP LISOS CHMX25",0908000011
956,"SORBETE POLIP MIXTOS CHMX25",0908000012
957,"TERMOMETRO DIGITAL CHM",0120000521
958,"TERMOMETRO INFRAROJO CHM",0120000523
959,"VARIEGATO FRUTILLA TCLASS",0115000194
960,"VIRUTA DECO AMARILLO LWC",0201000872
961,"VIRUTA DECO NATURAL LWC",0201000876
962,"PIROTIN N8 ROJO LUN GDE MOLP",0901000323
998,"PIROTIN N8 ROSA LUN GDE MOLP",0901000324
999,"CHOCOLATE LECHE COFLER X55G",0802000085
1000,"CHOCOLATE ROCKLETS COFLER X55G",0802000087
1001,"CHOCOLATE DIAFORT FFORT X50G",0802000092
1002,"CHOCOLATE BCO GRAFFITI X45G",0802000094
1003,"CHOCOLATE NGO GRAFFITI X45G",0802000096
1004,"CHOCOLATE KINDER MAXI X21G",0802000097
1005,"CHOCOLATE KINDER MAXI 10X21G",0802000098
1006,"CHOCOLATE ALMEN LEGER MILKX50G",0802000099
1007,"CHOCOLATE COMB LEGER MILKX45G",0802000100
1008,"CHOCOLATE LECHE LEGER MILKX45G",0802000101
1009,"CHOCOLATE C/ALMEND MILKA X50G",0802000102
1010,"CHOCOLATE C/LECHE MILKA X20G",0802000103
1011,"CHOCOLATE C/LECHE MILKA X55G",0802000104
1012,"CHOCOLATE OREO MILKA X20G",0802000105
1013,"CHOCOLATE BCO OREO MILKA X20G",0802000107
1014,"CHOCOLATE P/TAZA AGUILA X100G",0802000109
1015,"CHOCOLATE P/TAZA AGUILA X14G",0802000110
1016,"CHOCOLATE P/TAZA AGUILA X150G",0802000111
1017,"CHOCOLATE PAUSE MILKA X45G",0802000112
1018,"CHOCOLATE PAUSE OREO MILKAX45G",0802000113
1019,"CHOCOLATE RELL FRUTILLA COFLER",0802000114
1020,"CHOCOLATE BCO RELL TOFI X55G",0802000115
1021,"CHOCOLATE ROCKLETS COFLERX100G",0802000116
1022,"CHOCOLATE S/AZUCAR MAPSA X100G",0802000117
1023,"CHOCOLATE TENTACION AGUILAX12G",0802000119
1024,"CHOCOLATIN BLANCO ARCOR 40X8G",0802000120
1025,"CHOCOLATIN C/LECHE ARCOR X8G",0802000122
1026,"CHOCOLATIN BANANA SAPITO DISPL",0802000123
1027,"CHOCOLATIN MANI SAPITO DISPL",0802000125
1055,"CHOCOLATIN DDLECH SAPITO DISPL",0802000126
1056,"CHOCOLATIN FRUTIL SAPITO DISPL",0802000127
1057,"CHOCOLATIN SAPITO X10G",0802000128
1058,"CHUPETIN FRUTAL BABY DOLL X24U",0803000002
1059,"CHUPETIN ANA/UVA CEBOLLITA X6G",0803000004
1060,"CHUPETIN ANA/UVA CEBOLLITAX40U",0803000005
1061,"CHUPETIN CEREZ-MZNA BLOCA X24U",0803000007
1062,"CHUPETIN CEREZ-MZNA BLOCA X16G",0803000008
1063,"CHUPETIN CHOCO ABU MECHA DISPL",0803000009
1064,"CHUPETIN CHOCO ABU MECHA X20G",0803000010
1065,"CHUPETIN CHOCO CHUPELATIN X15G",0802000129
1066,"CHUPETIN CHUPETONCITO X35G",0803000011
1067,"CHUPETIN FRUTAL MR POPS X50U",0803000013
1068,"CHUPETIN PICO DULCE X14G",0803000014
1069,"CHUPETIN PICO DULCE 48X14G",0803000015
1070,"CHURRERA HOJALATA CA",0120000294
1071,"CHURRERA PLAST C/PICO CA",0120000295
1072,"CINTA EMPAQUE STIKO X50M",0702000005
1073,"CINTA FLORAL BCO DECO X2",0701000050
1074,"CINTA FLORAL VERDE CLA DECO X2",0701000051
1075,"CINTA FLORAL VERDE OSC DECO X2",0701000052
1076,"CINTA 011 AMARILLO BALLOUX50M",0905000004
1077,"CINTA 011 AZUL BALLOUX50M",0905000005
1078,"CINTA 011 BLANCO BALLOUX50M",0905000006
1079,"CINTA 011 BORDO BALLOUX50M",0905000007
1080,"CINTA 011 CELESTE BALLOUX50M",0905000008
1081,"CINTA 011 DORADO BALLOUX50M",0905000009
1082,"CINTA 011 FUCSIA BALLOUX50M",0905000010
1083,"CINTA 011 LILA BALLOUX50M",0905000011
1084,"CINTA 011 MARFIL BALLOUX50M",0905000012
1115,"CINTA 011 MARRON BALLOUX50M",0905000013
1116,"CINTA 011 NARANJA BALLOUX50M",0905000014
1117,"CINTA 011 NEGRO BALLOUX50M",0905000015
1118,"CINTA 011 PLATA BALLOUX50M",0905000016
1119,"CINTA 011 ROJA BALLOUX50M",0905000017
1120,"CINTA 011 SALMON BALLOUX50M",0905000019
1121,"CINTA 011 TURQUESA BALLOUX50M",0905000020
1122,"CINTA 011 VERDE MZN BALLOUX50M",0905000021
1123,"CINTA 011 VERDE BALLOUX50M",0905000022
1124,"CINTA 011 VIOLETA BALLOUX50M",0905000023
1125,"CINTA 02 AMARILLO BALLOUX25M",0905000024
1126,"CINTA 02 AZUL BALLOUX25M",0905000025
1127,"CINTA 02 BLANCO BALLOUX25M",0905000026
1128,"CINTA 02 CELESTE BALLOUX25M",0905000027
1129,"CINTA 02 DORADO BALLOUX25M",0905000028
1130,"CINTA 02 FUCSIA BALLOUX25M",0905000029
1131,"CINTA 02 LILA BALLOUX25M",0905000030
1132,"CINTA 02 NARANJA BALLOUX25M",0905000031
1133,"CINTA 02 NEGRO BALLOUX25M",0905000032
1134,"CINTA 02 PLATA BALLOUX25M",0905000033
1135,"CINTA 02 ROJO BALLOUX25M",0905000034
1136,"CINTA 02 ROSA CLARO BALLOUX25M",0905000035
1137,"CINTA 02 ROSA BALLOUX25M",0905000036
1138,"CINTA 02 SALMON BALLOUX25M",0905000037
1139,"CINTA 02 VERDE CLAR BALLOUX25M",0905000038
1140,"CINTA 02 VERDE MZNA BALLOUX25M",0905000039
1141,"CINTA 02 VERDE BALLOUX25M",0905000040
1142,"CINTA 02 VIOLETA BALLOUX25M",0905000041
1143,"CINTA 03 AMARILLO BALLOUX50M",0905000042
1144,"CINTA 03 AZUL BALLOUX50M",0905000043
1175,"CINTA 03 BLANCO BALLOUX50M",0905000044
1176,"CINTA 03 CELESTE BALLOUX50M",0905000046
1177,"CINTA 03 FUCSIA BALLOUX50M",0905000048
1178,"CINTA 03 LILA BALLOUX50M",0905000049
1179,"CINTA 03 NARANJA BALLOUX50M",0905000052
1180,"CINTA 03 NEGRO BALLOUX50M",0905000053
1181,"CINTA 03 ROJO BALLOUX50M",0905000055
1182,"CINTA 03 ROSA BALLOUX50M",0905000056
1183,"CINTA 03 TURQUESA BALLOUX50M",0905000058
1184,"CINTA 03 VERDE MZNA BALLOUX50M",0905000059
1185,"CINTA 03 VERDE BALLOUX50M",0905000060
